id,body,author,subreddit,created_datetime,score,ups,downs,link_id,parent_id,permalink,is_submitter,controversiality,gilded
c3qioxh,"Anybody considering how to vote for this stock should probably read the [discussion](http://www.reddit.com/r/investing/comments/pm766/tsla_tesla_motors_5_reasons_to_buy_tesla/) that is currently happening in /r/investing, where the OP reposted the exact same post.",Zurevu,InvestmentClub,12-02-2012 20:50,5,5,0,t3_pl0ko,t3_pl0ko,,,0,0
c3qiq1a,"i have to admit, it's a good discussion",ajsmithjr,InvestmentClub,12-02-2012 20:53,1,1,0,t3_pl0ko,t1_c3qioxh,,,0,0
c3qj0bd,ah woops.  My bad!,Lihadrix,InvestmentClub,12-02-2012 21:21,1,1,0,t3_pjmo8,t1_c3qil6k,,,0,0
c3qjsuj,One thing to note is the new announced dividend is $1.25 down from the $1.40 it's been for the past couple of years.,cjw200,InvestmentClub,12-02-2012 22:37,2,2,0,t3_p6qgm,t3_p6qgm,,,0,0
c3ql0oh,"You got to be kidding... Just because you fall in love with a company's products is NOT a reason to buy their stock - no matter how much you try to rationalize it (your 5 points above).  I could go point by point to refute the 5 arguments you listed above - but the numbers speak for themselves.

Have you even read their 10K and 10Q filings???  Among the gems: ""Since inception, we have incurred significant losses and have used approximately $418 million of cash in operations through September 30, 2011""  

""We anticipate that we will experience a significant increase in losses and will experience a significant decrease in revenues prior to the launch of the Model S. ""

""Our second planned vehicle, our Model S, is not expected to be in production until mid-2012, requires significant investment prior to commercial introduction, and may never be successfully developed or commercially successful. There can be no assurance that we will be able to design future models of performance electric vehicles that will meet the expectations of our customers or that our future models, including the Model S, will become commercially viable. To the extent that we are not able to build the production Model S to the expectations created by the early prototypes and our anticipated specifications, customers may cancel their reservations, our future sales could be harmed and investors may lose confidence in us""

""Our production model for the non-powertrain portion of the Model S is unproven, still evolving and is very different from the non-powertrain portion of the production model for the Tesla Roadster.""

They've already drawn down half of a gigantic 500M loan from the DOE...and their capital expenditures have not even hit the books yet.  And for anyone who has dealt with DOE grants before - it is an administrative nightmare.  Tesla hasn't even built the out their Freemont factory yet - you know the one having a bunch of environmental problems..  

So yeah whatever... great buy.",bboy1977,InvestmentClub,13-02-2012 00:34,1,1,0,t3_pl0ko,t3_pl0ko,,,0,0
c3ql2pz,they put that shit in there so they don't get sued from investors... just because something is in a 10-k doesn't mean it's going to happen. everything is looking good at the moment,ajsmithjr,InvestmentClub,13-02-2012 00:40,0,0,0,t3_pl0ko,t1_c3ql0oh,,,0,0
c3ql9pt,what does IVR do... need more info,dbs1019,InvestmentClub,13-02-2012 00:59,2,2,0,t3_pmhd9,t3_pmhd9,,,0,0
c3qlbyu,"Yes what does it do..
",vkny88,InvestmentClub,13-02-2012 01:05,1,1,0,t3_pmhd9,t1_c3ql9pt,,,0,0
c3qlmxn,[deleted],[deleted],InvestmentClub,13-02-2012 01:35,1,1,0,t3_pjmo8,t1_c3pyqiu,,,0,0
c3qlqlz,its a REIT.....a Real Estate Investment Trust.,Coldheat,InvestmentClub,13-02-2012 01:44,1,1,0,t3_pmhd9,t1_c3qlbyu,,,0,0
c3qls3i,"Actually their share price fell from almost 300$ per share to less than 70$ per share, significantly more than half, however it has rebounded somewhat to ~125",Coldheat,InvestmentClub,13-02-2012 01:48,2,2,0,t3_pl0ko,t1_c3q8skz,,,0,0
c3qlt4r,"Optimism is always a good thing, but it seems that you have already made your mind up on your position....if you want to invest heavily into the stock and you are convinced...do it....however if you are simply looking for validation here...it seems you are not going to get a cheer section behind you.  ",Coldheat,InvestmentClub,13-02-2012 01:51,1,1,0,t3_pl0ko,t1_c3q8vpw,,,0,0
c3qmlc2,People said the same shit about amazon...that was a great buy...,DarkHydra,InvestmentClub,13-02-2012 03:07,0,0,0,t3_pl0ko,t1_c3ql0oh,,,0,0
c3qmm3y,"hi there, i edited the original post to try to answer your question.  cheers.",Lihadrix,InvestmentClub,13-02-2012 03:09,2,2,0,t3_pmhd9,t1_c3ql9pt,,,0,0
c3qngpf,"Well I wasn't sure if ajsmith would be able to comprehend that it fell 76% and then climbed back up, so I made the numbers nice and simple for him. /sarcasm

In all seriousness though, I know how bad it was, I was watching their stock the whole time that it fell. Sometimes companies are overhyped, and sometimes even great CEOs make mistakes. ",hedgefundaspirations,InvestmentClub,13-02-2012 04:28,1,1,0,t3_pl0ko,t1_c3qls3i,,,0,0
c3qo3ih,"Yeah I would have to agree the guy seems a little bit too much of a an emotional gambler with no idea of caution or risk.  Could they be the ""next big thing""? Maybe, but I think it could be two years down the road if then, with a lot possibly going wrong in the mean time.  While personally being a fan of ""green"" technology it just hasn't taken off yet financially speaking.  Tbh electric cars as a whole still need to become more practical before they see widespread use, maybe when that gets a little closer to fruition, and tesla is still around, I would think about going long with them.  That's a lot of rambling....lol sry.  I'm a young adult researching/dabbling and just like to discuss things.

TLDR; dude is obviously emotional and there are better investments out there now IMO.",Coldheat,InvestmentClub,13-02-2012 05:28,1,1,0,t3_pl0ko,t1_c3qngpf,,,0,0
c3qok52,"http://www.reddit.com/r/investing/comments/pm766/tsla_tesla_motors_5_reasons_to_buy_tesla/c3qoj0k

He is seeing the company as what he would like to be, not what it is right now. We are a bunch of techies that would love to see a gas based alternative, but the economics of it aren't going to work out for a long time coming, barring some radical production level (meaning not some MIT scientists in a lab, but rather a real and actively produced) breakthrough in battery technology.",hedgefundaspirations,InvestmentClub,13-02-2012 06:14,1,1,0,t3_pl0ko,t1_c3qo3ih,,,0,0
c3qqgax,"&gt;I recently posted a thread in r/politics about if the Republicans could win the presidency. reddit's reaction was a unanimous no due to the poor quality of this year's GOP candidates.

The thoughts of [/r/politics](/r/politics) is worth very little. A significant number thought Ron Paul might be successful this time around. I wouldn't invest money based on their predictions. ",winfred,InvestmentClub,13-02-2012 11:57,1,1,0,t3_pl0ko,t1_c3qgj2f,,,0,0
c3qrgru,"They make money from the spread between the interest paid on the debt creating the leverage (i.e. the IR to purchase the MBSs) and the income coming in from the MBSs.  

So yes, you're right, very susceptible to interest rate risk, since a rise in IR would raise the cost of the ""interest paid on the debt"", while the mortgages would be the same price. 

[Here's a good overview](http://www.caseyresearch.com/articles/agency-mortgage-reits-dividend-darling-or-greater-fool) of the risks associated with AMREITs. 

Should be an OK play through 2014, but any sign of a rise in interest rates would make me jump ship immediately. ",animalspirit,InvestmentClub,13-02-2012 15:00,2,2,0,t3_p6qgm,t1_c3oeps8,,,0,0
c3qrius,who won?,madmoneybooyah,InvestmentClub,13-02-2012 15:07,1,1,0,t3_pjmo8,t3_pjmo8,,,0,0
c3qrotr,Just bought 200 shares.,xnoybis,InvestmentClub,13-02-2012 15:28,1,1,0,t3_pl0ko,t3_pl0ko,,,0,0
c3qrpsz,"before the jump this morning or right now at $31.20? either is good
",ajsmithjr,InvestmentClub,13-02-2012 15:31,1,1,0,t3_pl0ko,t1_c3qrotr,,,0,0
c3qrzh7,Tesla Motors. Please read the sidebar. Thanks.,Zurevu,InvestmentClub,13-02-2012 16:01,1,1,0,t3_pjmo8,t1_c3qrius,,,0,0
c3qs11k,Before the jump this morning.,xnoybis,InvestmentClub,13-02-2012 16:06,1,1,0,t3_pl0ko,t1_c3qrpsz,,,0,0
c3qsnrj,a mortgage reit - which holds agency/private label rmbs - and the main thing you need to worry about with these companies is pre-payment/refi programs that will come out from the government - alot of these securities allowed to be held are well above par and any headline risk about those factors will cause investors to run for a short period thinking the govt will be able to do anything,fidigw,InvestmentClub,13-02-2012 17:08,1,1,0,t3_pmhd9,t1_c3qlqlz,,,0,0
c3qtw2y,Yay! Tesla won Investment Club's first stock pick!,madmoneybooyah,InvestmentClub,13-02-2012 18:57,0,0,0,t3_pl0ko,t3_pl0ko,,,0,0
c3qtwzz,"It seems like Investment Club... made the right choice

YYYYEEEEEEEEAAAAAAAAAAAAAAAAAAAAAAAAHHH!!!",ajsmithjr,InvestmentClub,13-02-2012 18:59,0,0,0,t3_pl0ko,t1_c3qtw2y,,,0,0
c3qvaky,"Congrats on having the winning recommendation.

From now on we're requiring stock recommendations to include a rationale for selling. So, what's your reasoning for selling TSLA?",Zurevu,InvestmentClub,13-02-2012 20:53,1,1,0,t3_pl0ko,t3_pl0ko,,,0,0
c3qvc5b,"thanks

like what events or financial situations that would cause me to want to sell tesla? how specific/short/long does my answer have to be.

let me know i'll get back to you as soon as i can with my answer, or i'll update the post with it?",ajsmithjr,InvestmentClub,13-02-2012 20:57,1,1,0,t3_pl0ko,t1_c3qvaky,,,0,0
c3qve8p,"Yes. It can be as long or short as you want. It doesn't have to be very specific as that would be hard to do. Yeah, update your post. Thanks a lot.",Zurevu,InvestmentClub,13-02-2012 21:01,1,1,0,t3_pl0ko,t1_c3qvc5b,,,0,0
c3qvuqk,"no, problem. i'm doing some research ",ajsmithjr,InvestmentClub,13-02-2012 21:40,1,1,0,t3_pl0ko,t1_c3qve8p,,,0,0
c3qwpqd,"Awesome.

Are stocks that are added to the portfolio ever sold?

Additional links about Tesla (and a video):

* http://www.marketwatch.com/story/tesla-unveils-its-model-x-2012-02-10#

* http://vimeo.com/36534892

* http://www.forbes.com/sites/eco-nomics/2012/02/13/why-the-tesla-model-x-is-a-home-run/",bgritzut,InvestmentClub,13-02-2012 22:55,3,3,0,t3_pny4m,t3_pny4m,,,0,0
c3qxp3i,"Yes, they are sold when they meet criterions set by the OP/community. All OPs are now required to include a reason for selling their stock pick. ",Zurevu,InvestmentClub,14-02-2012 00:25,1,1,0,t3_pny4m,t1_c3qwpqd,,,0,0
c3qym4b,"i updated my with post with reasons to sell, thanks for all the upvotes.

How do we decide exactly when it's time to sell?",ajsmithjr,InvestmentClub,14-02-2012 01:54,2,2,0,t3_pny4m,t1_c3qxp3i,,,0,0
c3qynl6,That hasn't been decided yet. Why are you thanking me for upvotes? I didn't vote up or down for your post.,Zurevu,InvestmentClub,14-02-2012 01:58,0,0,0,t3_pny4m,t1_c3qym4b,,,0,0
c3qyqms,was thanking everyone for all the upvotes in general,ajsmithjr,InvestmentClub,14-02-2012 02:06,1,1,0,t3_pny4m,t1_c3qynl6,,,0,0
c3r0ize,"To add a few things: they release their 10k on Thursday 2/16, their decision to add a 9th fleet was only made public a few days ago (and is, imo, a very good indication that there is going to be demand for their services for a prolonged period of time), they sign unique ""take or pay"" contracts with their clients - the contracts are 2 years long and when/if there is downtime, C &amp; J can take advantage of spot market jobs if the opportunities present themselves. Management seems very sound &amp; has a lot of experience, their IPO was in late July 2011 - they used the proceeds to pay off their debt. Their clients are basically split between oil/wet gas, and their clients are actively seeking to increase their oil exposure. The only risk is that fracking will become outlawed in Texas and surrounding states - something I think is overblown, but is why the stock price has been depressed since the IPO",AmplyCaffeinated,InvestmentClub,14-02-2012 04:53,2,2,0,t3_ponfn,t3_ponfn,,,0,0
c3r19t3,Shrewd salient investment tips?,WisdomMountain,InvestmentClub,14-02-2012 06:17,1,1,0,t3_pordx,t3_pordx,,,0,0
c3r19zj,The Model X article you provided is a great read,ajsmithjr,InvestmentClub,14-02-2012 06:18,1,1,0,t3_pny4m,t1_c3qwpqd,,,0,0
c3r1d47,"ugghhh, it's so high rite now, i thought it was high at $450. but there might still be room from profit so i upvoted you",ajsmithjr,InvestmentClub,14-02-2012 06:28,2,2,0,t3_pmw84,t3_pmw84,,,0,0
c3r3uvz,What are coil tubing units and double pump pressure pumps?,Zurevu,InvestmentClub,14-02-2012 14:22,1,1,0,t3_ponfn,t3_ponfn,,,0,0
c3r44wn,"I think it'll pull back in the near future, but it'll continue to grow in the slightly longer term.",theHomers,InvestmentClub,14-02-2012 14:56,1,1,0,t3_pmw84,t1_c3r1d47,,,0,0
c3r4q0l,"I thought it was high at 200 and didn't invest.  Then again at 300, and once more at 400.  I went in and haven't looked back.  Great company, great products, insane amounts of cash, and the biggest company in the world.  With all that said, there's still plenty of upside in their two most lucrative businesses (smart phones and tablets)",SubterraneanAlien,InvestmentClub,14-02-2012 15:56,1,1,0,t3_pmw84,t1_c3r44wn,,,0,0
c3r5s5r,"Equipment that makes fracking possible. The larger the diameter of the tubes, the better they are. The more pumps, the better they are. Almost all of CJES' coil tubes are 2"" diameter, which are relatively large. I'm not sure if triple pump pressure pumps exist, but their double pumps work up to 15,000 psi which is relatively high.",AmplyCaffeinated,InvestmentClub,14-02-2012 17:32,2,2,0,t3_ponfn,t1_c3r3uvz,,,0,0
c3r6763,Could you please explain under what conditions you would sell AAPL? It's a new requirement.,Zurevu,InvestmentClub,14-02-2012 18:07,1,1,0,t3_pmw84,t3_pmw84,,,0,0
c3r6apj,"How do you know that ""almost all of CJES' coil tubes are 2"" in diameter"" and that ""their double pumps work up to 15,000 psi""? Do you work in the industry?",Zurevu,InvestmentClub,14-02-2012 18:16,1,1,0,t3_ponfn,t1_c3r5s5r,,,0,0
c3r6bll,Could you please explain under what conditions you'd want to sell CJES? It's a new requirement. Thanks.,Zurevu,InvestmentClub,14-02-2012 18:18,1,1,0,t3_ponfn,t3_ponfn,,,0,0
c3r6r8q,"Because I read their SEC filings, and I've learned a good amount about the fracking industry due to my interest in this company. No I don't work in the industry.",AmplyCaffeinated,InvestmentClub,14-02-2012 18:55,1,1,0,t3_ponfn,t1_c3r6apj,,,0,0
c3r6sr6,"I'd want to sell when their price is closer to the industry standard of ~13x earnings, or if they make a really shitty acquisition. ",AmplyCaffeinated,InvestmentClub,14-02-2012 18:59,2,2,0,t3_ponfn,t1_c3r6bll,,,0,0
c3r6ub5,Does this club have any market timing component to it?  Does it feel a need to have any?,diogenes227,InvestmentClub,14-02-2012 19:02,2,2,0,t3_pny4m,t3_pny4m,,,0,0
c3r7b7r,[deleted],[deleted],InvestmentClub,14-02-2012 19:42,2,2,0,t3_pny4m,t3_pny4m,,,0,0
c3r7lbg,~~From my lemonade stand. Where else?~~ Please read the sidebar. Thanks.,Zurevu,InvestmentClub,14-02-2012 20:05,2,2,0,t3_pny4m,t1_c3r7b7r,,,0,0
c3r82c7,[deleted],[deleted],InvestmentClub,14-02-2012 20:44,1,1,0,t3_pny4m,t1_c3r7b7r,,,0,0
c3r8sq8,"From the sidebar:
&gt;DISCLAIMER: /r/investmentclub is for entertainment purposes only!",Zurevu,InvestmentClub,14-02-2012 21:44,1,1,0,t3_pl0ko,t1_c3qrotr,,,0,0
c3r9fk1,"Sorry, is the gigaom article supposed to be related to reasons for selling? That article won't do. Can you present some reasons for selling TSLA? Thanks.",Zurevu,InvestmentClub,14-02-2012 22:38,1,1,0,t3_pl0ko,t1_c3qvuqk,,,0,0
c3rag9j,But.... this is Honda Motors we're talking about. ,AmplyCaffeinated,InvestmentClub,15-02-2012 00:13,1,1,0,t3_p8tvw,t1_c3q8mli,,,0,0
c3rajzz,Haha - I have a lot of liquid capital to play with for the next 2 years.,xnoybis,InvestmentClub,15-02-2012 00:23,1,1,0,t3_pl0ko,t1_c3r8sq8,,,0,0
c3raw1d,[deleted],[deleted],InvestmentClub,15-02-2012 00:55,1,1,0,t3_pmw84,t1_c3r4q0l,,,0,0
c3rd3vf,Where does the voting take place? Where is the discussion for/against it?,[deleted],InvestmentClub,15-02-2012 04:28,1,1,0,t3_pny4m,t3_pny4m,,,0,0
c3rdrpk,"basically you post a stock name with its ticker symbol and then in the descriptions give reasons for buying and selling the stock, then the stock with the most upvotes wins. i think a stock is picked every week? not sure on that though",ajsmithjr,InvestmentClub,15-02-2012 05:36,1,1,0,t3_pny4m,t1_c3rd3vf,,,0,0
c3rfek4,"&gt;By too soon, I mean that all previous investment clubs on reddit have failed.

Why have they failed?",[deleted],InvestmentClub,15-02-2012 09:47,1,1,0,t3_p6dut,t1_c3my4wy,,,0,0
c3rj8bk,"good tip, its up 8% since you posted this",preo,InvestmentClub,15-02-2012 18:29,2,2,0,t3_pl0ko,t3_pl0ko,,,0,0
c3rjcxz,"earnings after the bell, $40 million in Model X pre orders",ajsmithjr,InvestmentClub,15-02-2012 18:39,2,2,0,t3_pl0ko,t1_c3rj8bk,,,0,0
c3rkxn7,"This is awesome, after the multiple discussions you had and the insanity of certain individuals on the investment forum I'm really glad they decided to go with Tesla.",DarkHydra,InvestmentClub,15-02-2012 20:46,1,1,0,t3_pny4m,t1_c3qyqms,,,0,0
c3rl2h5,"I'm waiting for after hours, it's either going to break $35 and move closer to $40 or pull a Zynga",ajsmithjr,InvestmentClub,15-02-2012 20:57,1,1,0,t3_pny4m,t1_c3rkxn7,,,0,0
c3rlhio,I really think it depends on the pipeline that Apple has.  They need to continue to innovate and people are starting to question why they should pay 800$ for an iPad when there are similar lower cost substitutes in the market.  Unless they add more value people are going to start buying Kindle Fire and Samsung.  It's a problem that Apple doesn't have a strong competitive advantage with an economic moat.  That makes me shakey at this point to buy the stock.,DarkHydra,InvestmentClub,15-02-2012 21:30,1,1,0,t3_pmw84,t1_c3r44wn,,,0,0
c3rlwuq,LOL!!! Pull a Zynga!!,DarkHydra,InvestmentClub,15-02-2012 22:04,1,1,0,t3_pny4m,t1_c3rl2h5,,,0,0
c3rmj0v,"In the short-er term: Within a quarter or so, it will become clearer when iPhone 5 will be released. If, like last year, it looks like it'll be released in Q4, Q3 earnings will be underwhelming. I would sell before Q3 earnings in this case.",theHomers,InvestmentClub,15-02-2012 22:56,1,1,0,t3_pmw84,t1_c3r6763,,,0,0
c3rmqc6,"$829 is the price point for the most expensive iPad. Currently, the entry level is $499. Still, it's well above Amazon's loss leading $199, but this is the first year Apple has had any real competition in tablets. I wouldn't be surprised if Apple got a little more aggressive with pricing this year, perhaps continuing to sell the iPad 2 for $399.

The holiday quarter's iPad numbers (over 15 mil, 100%+ yoy growth) came after Kindle Fire's well publicized launch. I think people prefer iPads, and while some may settle for a competitor, most won't, including all the enterprises already using iPads. Plus, once people have an iPad at work, they're not buying a Samsung for home use. I think this was one of the main reasons that Microsoft dominated the computer industry.

They also have at least a 2 year head start. This is true for manufacturing costs, features in the pipeline, public perspective and brand recognition, and accessories and 3rd party software support.

The other factor is that the iPad is only 1 of 4 successful, high margin product lines and it may soon be only 1 of 5.",theHomers,InvestmentClub,15-02-2012 23:14,2,2,0,t3_pmw84,t1_c3rlhio,,,0,0
c3rmwny,"ok, well it went up to $36 for a split second, then it lingered between 35.40 and 35.80. i got out at $35.50. now it's down at 33.77 which is still up 17cents from the close price. we might see a pop back up tomorrow or it might just trade sideways, but still up from investment club's 31.25 position",ajsmithjr,InvestmentClub,15-02-2012 23:30,2,2,0,t3_pny4m,t1_c3rlwuq,,,0,0
c3rnumo,"All good points!
",DarkHydra,InvestmentClub,16-02-2012 00:57,1,1,0,t3_pmw84,t1_c3rmqc6,,,0,0
c3roxlq,i wish i could afford one :(,preo,InvestmentClub,16-02-2012 02:35,1,1,0,t3_pl0ko,t1_c3rjcxz,,,0,0
c3rp3g0,What's the potential we can see this stock reach?,vkny88,InvestmentClub,16-02-2012 02:50,1,1,0,t3_preyb,t3_preyb,,,0,0
c3rp46s,"me to, maybe by 2013 well have enough from owning tesla stock to buy one",ajsmithjr,InvestmentClub,16-02-2012 02:52,1,1,0,t3_pl0ko,t1_c3roxlq,,,0,0
c3rshnp,"Here is the social network which may be alternative to facebook www.friendsred.com
it's like clone of 2010 facebook. but what it has free file sharing &amp; downloading feature's. it cool isn't it. maybe you should try it give it a chance..",malaygameti,InvestmentClub,16-02-2012 09:53,-6,-6,0,t3_preyb,t3_preyb,,,0,0
c3rt1rs,"I hate facebook and reddit as is.... don't think I need another soul sucker

EDIT: LMAO 286 members and counting.... this is not the next facebook",Elitist_Circle_Jerk,InvestmentClub,16-02-2012 12:23,1,1,0,t3_preyb,t1_c3rshnp,,,0,0
c3rt2ph,"I'm not really sure how you expect me to answer that.... IPO was in May, 52 week high of $20 was just before the additional share issuance last week. Buying pre-IPO is messy. But their largest holdings are Facebook and Twitter.

Also 90% of any gains from stock sales must be passed off as a dividend. ",Elitist_Circle_Jerk,InvestmentClub,16-02-2012 12:29,1,1,0,t3_preyb,t1_c3rp3g0,,,0,0
c3rurod,"Hey guys what about the robotics division they have been building?
Is this the same stock? or a different company. 
I mean this could be huge potential for the future?

Or am I wrong?",CheeseBurgerRandy,InvestmentClub,16-02-2012 16:11,2,2,0,t3_p8tvw,t3_p8tvw,,,0,0
c3rv7gj,What are your reasons for potentially selling GSVC? This is a new requirement. Thanks. (Please read the sidebar.),Zurevu,InvestmentClub,16-02-2012 16:50,1,1,0,t3_preyb,t3_preyb,,,0,0
c3rwu9u,"So you guys are saying jump in when stocks are low?
how many shares would you recommend ?",CheeseBurgerRandy,InvestmentClub,16-02-2012 19:07,1,1,0,t3_p8oj2,t3_p8oj2,,,0,0
c3rx3lt,"Same company and I think you're spot on.  Honda has a technological competitive advantage over other Japanese car makers.  

Disclosure:  I am long HMC",DarkHydra,InvestmentClub,16-02-2012 19:29,1,1,0,t3_p8tvw,t1_c3rurod,,,0,0
c3ry42j,What % of there portfolio is allocated to Zynga and Facebook?,ttg314,InvestmentClub,16-02-2012 20:49,2,2,0,t3_preyb,t3_preyb,,,0,0
c3ry5tc,"because of there robotic development?
Or just because they are honda?",CheeseBurgerRandy,InvestmentClub,16-02-2012 20:53,1,1,0,t3_p8tvw,t1_c3rx3lt,,,0,0
c3ryo9k,"Were my cons not good enough? The biggest sell reason I guess is because we average investors can't value private companies with the same transparencies as public companies. Also if GSVC keep issuing new shares after new shares after new shares it begins to feel like a Ponzi scheme.

I tried to keep it short and sweet but next time I'll be more detailed",Elitist_Circle_Jerk,InvestmentClub,16-02-2012 21:33,1,1,0,t3_preyb,t1_c3rv7gj,,,0,0
c3ryq19,"Well, a little of both.  A honda isn't built like a Toyota and Honda cars have better service rates plus longevity than Toyota.

Honda also has types of cars that are not sold in the US that are on the streets of Asia such as solar panel powered cars.  ",DarkHydra,InvestmentClub,16-02-2012 21:36,1,1,0,t3_p8tvw,t1_c3ry5tc,,,0,0
c3ryvb1,"350,000 shares of Class B common stock of Facebook (represents 16% of the portfolio)

With respect to Zynga, they hold a $4m unsecured promissory note  maturing Aug 2012, includes a return based on the relative value of the common stock of Zynga - 10-20% if priced at $6 billion to $14 billion
",Elitist_Circle_Jerk,InvestmentClub,16-02-2012 21:48,3,3,0,t3_preyb,t1_c3ry42j,,,0,0
c3ryy93,"Because a large part of there portfolio is social media, I don't like it. Possibly I will if they sell there Zynga shares, and after the Facebook IPO and such, but for now I think they will underperform.",ttg314,InvestmentClub,16-02-2012 21:55,2,2,0,t3_preyb,t1_c3ryvb1,,,0,0
c3rzcxw,Feel free to add whatever information you would like to your original post. The more info the better.,Zurevu,InvestmentClub,16-02-2012 22:29,1,1,0,t3_preyb,t1_c3ryo9k,,,0,0
c3s00ks,"The note attached to Zynga shares matures and turns into cash Aug this year :) 


you know you want to like it",Elitist_Circle_Jerk,InvestmentClub,16-02-2012 23:25,1,1,0,t3_preyb,t1_c3ryy93,,,0,0
c3s0591,"Hopefully they will sell it sooner, if they have any sense I'm sure they will.",ttg314,InvestmentClub,16-02-2012 23:36,1,1,0,t3_preyb,t1_c3s00ks,,,0,0
c3s09di,"I sent their investor relations department a letter to ask on their procedure for post-IPO investments. More so in concerns to Groupon

They don't actually own Zynga shares, they have a note that pays interest based on Zynga's performance. They must have sold some of their private shares in exchange for the safer note when Zynga went public",Elitist_Circle_Jerk,InvestmentClub,16-02-2012 23:47,1,1,0,t3_preyb,t1_c3s0591,,,0,0
c3s0iy7,"I'm really hoping they move the development of the Gen III vehicle ahead of schedule. It'll be good from an investment point of view and they'll finally be making a car that I can afford. 

I'm really looking forward to the next couple of years for Tesla.",[deleted],InvestmentClub,17-02-2012 00:11,2,2,0,t3_ps0o3,t3_ps0o3,,,0,0
c3s0rwf,"You sent them a letter? Wow, committed. I like that.

As for the Zynga thing, that seems alot better. I'm defiantly reconsidering it. ",ttg314,InvestmentClub,17-02-2012 00:34,1,1,0,t3_preyb,t1_c3s09di,,,0,0
c3s2h7h,Update. Icahn just made a tender offer for $30/share plus contingent value rights.,theduude,InvestmentClub,17-02-2012 03:18,1,1,0,t3_p70hg,t3_p70hg,,,0,0
