id,body,author,subreddit,created_datetime,score,ups,downs,link_id,parent_id,permalink,is_submitter,controversiality,gilded
c42q6ho,I spoke on this a bit in a previous post. I bought Nokia about 3 weeks ago (currently down 3% since then) but I am in with them for the long haul. They have a high of $80 per share which I don't expect again but feel with all the hype around their lumia phones and windows phone 7 (remember they are more popular in europe than U.S.) that they will be making a strong come back here in the next few years. WP7 integrates very well with Xbox and will integrate even better with Windows 8. I'm hoping for big things and banking Nokia will be a big leader/ supporter of Windows devices. ,eggowaffles,InvestmentClub,19-03-2012 21:23,1,1,0,t3_r3xcj,t3_r3xcj,,,0,0
c42r8kw,"Bought it around $5/share for a long term hold. I think if any of the MSFT partnerships pan out, this stock will yield a nice return.",masonwoods,InvestmentClub,19-03-2012 22:59,1,1,0,t3_r3xcj,t1_c42q6ho,,,0,0
c42rlzq,What's your reason for selling?,Zurevu,InvestmentClub,19-03-2012 23:33,1,1,0,t3_r3xcj,t3_r3xcj,,,0,0
c42sw82,"I am in for the long haul so currently don't have a price that I am looking for to sell.  If Nokia continues to lose international market share without showing some growth potential or strategic partnerships, I would sell. ",masonwoods,InvestmentClub,20-03-2012 01:31,1,1,0,t3_r3xcj,t1_c42rlzq,,,0,0
c430n3z,Only problem I see is that you cannot buy the spot vix and those funds are invested in the futures and the futures curve is incredibly steep right now.,bgritzut,InvestmentClub,20-03-2012 17:33,2,2,0,t3_qx98f,t3_qx98f,,,0,0
c431m59,LOL tesla and ford.  You guys really know how to make a diversified portfolio. ,OMGNoMNoMNoM,InvestmentClub,20-03-2012 18:49,3,3,0,t3_r5ar3,t3_r5ar3,,,0,0
c434sxj,I'm not worried about it. We still have seventeen open positions to diversify the portfolio and Ford and Tesla aren't exactly going after the same consumers.,Zurevu,InvestmentClub,20-03-2012 23:04,1,1,0,t3_r5ar3,t1_c431m59,,,0,0
c435o5h,[deleted],[deleted],InvestmentClub,21-03-2012 00:21,1,1,0,t3_r5xtn,t3_r5xtn,,,0,0
c435ocs,[deleted],[deleted],InvestmentClub,21-03-2012 00:22,1,1,0,t3_r5xtn,t3_r5xtn,,,0,0
c435ol3,[deleted],[deleted],InvestmentClub,21-03-2012 00:22,1,1,0,t3_r5xtn,t1_c435ocs,,,0,0
c435oqi,[deleted],[deleted],InvestmentClub,21-03-2012 00:22,1,1,0,t3_r5xtn,t1_c435o5h,,,0,0
c437f37,how did ford win when EA had more upvotes,ajsmithjr,InvestmentClub,21-03-2012 02:58,1,1,0,t3_r5ar3,t3_r5ar3,,,0,0
c43cghj,"You mean when EA had a higher points score. The scores are not precise. Reddit fudges the scores to thwart cheaters/bots.

edit: We are switching to a comment based voting system to make counting votes more accurate *and more sensible*. More info to come.",Zurevu,InvestmentClub,21-03-2012 14:52,0,0,0,t3_r5ar3,t1_c437f37,,,0,0
c43fwgc,If anything buy some calls,ttg314,InvestmentClub,21-03-2012 19:13,1,1,0,t3_qx98f,t3_qx98f,,,0,0
c43fx8k,"Not a fan of buying Unions.

We already have 2 auto sector stocks so defiantly not.",ttg314,InvestmentClub,21-03-2012 19:14,-1,-1,0,t3_r0xa9,t3_r0xa9,,,0,0
c43i6pe,"Remember, you can always change your vote by crossing it out! 
__________________________________________________________
1 Hour Ago: ~~Yes: I like Amazon because I buy my stuff there and they are growing in sales~~

5 Minutes ago: No: Amazon is overvalued with a high P/E, I believe they will loose sales from other internet competitors 
        
       Half Hour Ago: Comment: Even though they are growing in sales, they're trading at 140 P/E!

",ttg314,InvestmentClub,21-03-2012 22:10,2,2,0,t3_r7cm9,t3_r7cm9,,,0,0
c43jh3g,Baupost Group founder Seth Klarman [bought HPQ in Q3 2011](http://seekingalpha.com/article/309630-baupost-group-s-big-q3-bets) for around the price it is now.,Zurevu,InvestmentClub,22-03-2012 00:06,1,1,0,t3_qzmnt,t3_qzmnt,,,0,0
c43jmvk,you think they are paying 4 percent this year? you crazy...,ShawnGupta,InvestmentClub,22-03-2012 00:21,3,3,0,t3_r3xcj,t3_r3xcj,,,0,0
c43l433,Is this when we raid their board with annuity income ads?,cdjcon,InvestmentClub,22-03-2012 02:35,2,2,0,t3_r7cm9,t3_r7cm9,,,0,0
c43miby,how will the comment voting system work?,ajsmithjr,InvestmentClub,22-03-2012 04:43,2,2,0,t3_r5ar3,t1_c43cghj,,,0,0
c43qcow,Check out this [post](http://www.reddit.com/r/InvestmentClub/comments/r7cm9/rinvestmentclub_new_commentbased_voting_system_in/) or read the sidebar.,Zurevu,InvestmentClub,22-03-2012 14:43,0,0,0,t3_r5ar3,t1_c43miby,,,0,0
c43w5g5,That was a good article. Thanks.,Zurevu,InvestmentClub,22-03-2012 22:32,1,1,0,t3_qzmnt,t1_c42nfxs,,,0,0
c43wl9k,[deleted],[deleted],InvestmentClub,22-03-2012 23:10,1,1,0,t3_r7cm9,t3_r7cm9,,,0,0
c43x665,"commenting so i can see this later

upvote for you",guthran,InvestmentClub,23-03-2012 00:03,1,1,0,t3_p8p4k,t3_p8p4k,,,0,0
c44000r,[deleted],[deleted],InvestmentClub,23-03-2012 04:12,1,1,0,t3_pmw84,t3_pmw84,,,0,0
c440x30,Just wanted to point out that this has increased almost 30% since I recommended it.,bobbyt2012,InvestmentClub,23-03-2012 05:46,1,1,0,t3_p6jm5,t1_c3mz8s3,,,0,0
c441h37,Is anybody buying Apple options? Or are most you guys buying straight stock? Thanks.,grex88,InvestmentClub,23-03-2012 06:57,1,1,0,t3_pmw84,t3_pmw84,,,0,0
c441hft,What's your thinking of where Apple stock price will be at after the iphone5 and iTV release?,grex88,InvestmentClub,23-03-2012 06:58,1,1,0,t3_pmw84,t1_c44000r,,,0,0
c44a3rj,[deleted],[deleted],InvestmentClub,23-03-2012 23:14,2,2,0,t3_pmw84,t1_c441hft,,,0,0
c44gmj9,buying high- a good strategy for you and not me,poohter,InvestmentClub,24-03-2012 16:06,2,2,0,t3_rapmj,t3_rapmj,,,0,0
c44hxe2,[deleted],[deleted],InvestmentClub,24-03-2012 18:28,1,1,0,t3_rapmj,t1_c44gmj9,,,0,0
c44iuil,"16.28x book value, not a big fan of that.  The lack of debt is concerning too, as it shows management is not taking advantage of the tax benefits of debt at all.  ",Philosofox,InvestmentClub,24-03-2012 20:05,2,2,0,t3_rapmj,t3_rapmj,,,0,0
c44jc2n,"Latest financials for FY 2011 are [here](http://sec.gov/Archives/edgar/data/879575/000104746912001622/a2207408z10-k.htm#fb18801_item_8._financial_statements_and_supplementary_data)

My reasons for no are: (1) They only have one customer. This places a lot of risk into the company should something happen to the customer; (2) ~75% of the company is owned by CF Industries. This gives CF easy rule of the board, and they could force TNH into any sort of situation, without consent from outside parties.

I'll add more as I continue reading the financials. Both positive and negatives.",fortworthfroggie,InvestmentClub,24-03-2012 20:58,1,1,0,t3_rapmj,t3_rapmj,,,0,0
c44nekn,"Because if there's one thing I need to round off my portfolio, it's an investment in cannabis.

I think I'm going to build an ent themed portfolio on Investopedia, just to screw around and see how it does.",BrokeJawa,InvestmentClub,25-03-2012 04:27,3,3,0,t3_rbury,t3_rbury,,,0,0
c44nnsa,[deleted],[deleted],InvestmentClub,25-03-2012 04:55,1,1,0,t3_rbury,t3_rbury,,,0,0
c44ns2d,"It probably has something to due with the fact that their primary product is... well... illegal.

They're a penny stock. They seem legit, but what hope do they have of making a profit as long as pot is illegal? They're not selling a product so much as they're selling dreams. ",BrokeJawa,InvestmentClub,25-03-2012 05:08,1,1,0,t3_rbury,t1_c44nnsa,,,0,0
c44p0qy,"&gt; In November I expect to see this stock take a couple swings because of legislation to legalize Marijuana but regulate it like Alcohol and Tobacco. 

Source please?",Underw00d,InvestmentClub,25-03-2012 07:59,1,1,0,t3_rbury,t3_rbury,,,0,0
c44p31a,"They seem to have a product line of hemp oil based lip balm and sunscreen lotion in the works.

Besides, they are based out of Colorado. One of the most lenient MJ states out there.",Nydas,InvestmentClub,25-03-2012 08:10,1,1,0,t3_rbury,t1_c44ns2d,,,0,0
c44qa5f,"In my opinion, this is a very poor quality company that should not be considered. 

**1. The ""Marijuana hype"" is already priced into the stock:**

The company has had ~ 74k in revenues YTD (almost all of which was one time, license revenues), on a run rate basis lets say that's 100k for the year. At the same time the company trades at a $21,000,000 valuation, which if you use this run-rate revenue number (which is very generous given their low recurring revenues) is a staggering valuation of 210x revenue. To put things into context, Salesforce.com trades at 10x revenue?

**2. In terms of financial health, this company is on the ropes and will continue to screw over its equity holders or choose to go bankrupt:**

They have around $1,200 in cash as of last quarter (again, this is not a typo, or wrong units), but they have total liabilities of $1,400,000, and are generating negative cash per quarter. Effectively they have been able to finance themselves only by issuing shares, which screw over equity holders through dilution (and at these valuations, why not sell your shares?). Its either that, or go bankrupt. Their accumulated equity deficit is around $68m.

**3. The head of the company has no experience with medical marijuana technology, and is solely a politician who wants to get marijuana legalized. He has no incentive to make this company work**

It appears to me that Steve Kubby is using this company as a vehicle to profit from his efforts to get marijuana legalized. If you read the 10-K, it was first an oil and gas company, that was converted into ""Cannabis Sciences."" This company was thrown together and from a high level overview, I feel there is no credible reason that they will generate attractive returns to shareholders. 

Doesn't look like something I would want to own by any means.",occupybourbonst,InvestmentClub,25-03-2012 13:30,7,7,0,t3_rbury,t3_rbury,,,0,0
c44rvxd,"http://www.boiseweekly.com/boise/colorado-to-vote-on-marijuana-legalization/Content?oid=2609902
",wombatcreasy,InvestmentClub,25-03-2012 17:00,1,1,0,t3_rbury,t1_c44p0qy,,,0,0
c44x9fk,"Great Outline.
I like to see an edit with say ford or Tesla and ""links"" as you described in this excellent primer.  Understand limited space, but this would solidified your guideline/example beginners should follow and possible new or additional info you have come across.   The must read alone could focus  the beginner on the right path.  Beware the  ""BRICK"" blogger.  ",dwek,InvestmentClub,26-03-2012 01:20,1,1,0,t3_p8p4k,t3_p8p4k,,,0,0
c45688y,"What would cause the vix to shoot up right now?  Are the elections priced in? International strife with Iran?  It is a bit low, but in part it seems like the world is taking a little bit of a break from the crazy we've had in the last 5 years (which have been super-extra-crazy).
That said, I would say Nay.",mattseg,InvestmentClub,26-03-2012 19:03,1,1,0,t3_qx98f,t3_qx98f,,,0,0
c457283,Agreed.  Plus it's stagnant.  I see more risk of going down than opporunities to go up. Nay,mattseg,InvestmentClub,26-03-2012 20:10,1,1,0,t3_r0xa9,t1_c425n3c,,,0,0
c457cvn,"I see a lot of upside.  As banks are upping fees, and more and more people are unbankable their money orders are the like are in demand.  Plus the US still isn't cracking down hard on immigrant labor, so little issue of that part of the business getting worse.",mattseg,InvestmentClub,26-03-2012 20:33,1,1,0,t3_q7qtl,t3_q7qtl,,,0,0
c4583yz,Great pick on Tesla.,AutonomousMonkey,InvestmentClub,26-03-2012 21:32,2,2,0,t3_reqr5,t3_reqr5,,,0,0
c45aw8s,"I think the investment club is more for stocks. I stay away from options personally, although I would consider purchasing some if I needed a hedge.",theHomers,InvestmentClub,27-03-2012 01:30,1,1,0,t3_pmw84,t1_c441h37,,,0,0
c46fyxm,I totally agree with you.  One of the little things that people don't know Win 7 Phone supports more languages than android.  Also it's a little bit faster than android and dev tools for it are awesome.,z960849,InvestmentClub,29-03-2012 23:32,-1,-1,0,t3_r3xcj,t3_r3xcj,,,0,0
c46q25f,"How do you know Nokia will yield 4% this year.  Last year they announced it only one day before the ex-div date: Quote from press release:
""Espoo, Finland -The Annual General Meeting of Nokia Corporation held on May 3, 2011 (the AGM) resolved to distribute a dividend of EUR 0.40 per share for 2010. The dividend ex-date is May 4, 2011 and the record date May 6, 2011. The dividend will be paid on or around May 20, 2011.""
",superpuggers,InvestmentClub,30-03-2012 18:32,1,1,0,t3_r3xcj,t3_r3xcj,,,0,0
c46z3g3,"There's a post on [/r/investment](/r/investment) somewhere that has all the tickers like POT, X, COKE, and so forth",Elitist_Circle_Jerk,InvestmentClub,31-03-2012 14:12,1,1,0,t3_rbury,t1_c44nekn,,,0,0
c4790ex,Is thera a link to this market? ,[deleted],InvestmentClub,01-04-2012 09:51,1,1,0,t3_rnioi,t3_rnioi,,,0,0
c47a3qv,"100% agree.



Spain also has a 50% youth unemployment and their own housing issues. Private and government sectors in massive debt. Doesn't look good.",bgritzut,InvestmentClub,01-04-2012 14:14,2,2,0,t3_rnioi,t3_rnioi,,,0,0
c47abwv,"I agree with this thesis. Spain has 25% unemployment, and an inflated housing market that has not yet burst.

Rather than short the ETF, I would recommend shorting either the #1 or #3 holding of the fund, (Banco Santander or BBVA). I would recommend BBVA since they are the shittier bank.

Long story short, the problems in Europe have not been solved, instead there is just a band-aid over a huge bullet hole. Portugal is hanging on by a thread, and if they cannot repay their debt, their credit markets will lock up and they will take the Spanish banks with them (two economies are so intertwined).

Banco Bilbao has some of the highest gross exposure to Portuguese and Spanish commercial debt. 15.66x PIIGS exposure to equity. 6% PIIGS write-downs would wipe out the equity.

But I would vote for the ETF if that was the only option.",occupybourbonst,InvestmentClub,01-04-2012 14:49,4,4,0,t3_rnioi,t3_rnioi,,,0,0
c47j00o,"Here's a good summary of some of the problems with [Spain](http://www.bloomberg.com/news/2012-04-01/mortgage-column.html). My only argument against your pick is it has a very mkt cap (&lt;$100m). IMO, it seems the sentiments see-saw every which way on any given day. I think the risks outweigh the rewards.",fortworthfroggie,InvestmentClub,02-04-2012 07:15,1,1,0,t3_rnioi,t3_rnioi,,,0,0
c47taau,"Agree with shorting Spain. The troubles have not ended for the country:
Economist article of the government starting to worry: http://www.economist.com/node/21551520
",smahmood,InvestmentClub,03-04-2012 01:37,1,1,0,t3_rnioi,t3_rnioi,,,0,0
c48lxvn,"I feel like I posted 1200 words of gibberish. I typed this quickly but I hope accurately. If you see any errors of fact or structure please help me to make this post better. If you disagree with my conclusion, strategy, or assumptions please let me know why and what I have overlooked.",z0n3,InvestmentClub,05-04-2012 01:08,6,6,0,t3_rtu9p,t3_rtu9p,,,0,0
c48mevc,"i made a post for buying electronic arts a few weeks ago, glad to see someone else is recommending it. you get an up vote!",ajsmithjr,InvestmentClub,05-04-2012 01:47,5,5,0,t3_rtu9p,t1_c48lxvn,,,0,0
c48mtv9,"Thanks, I read through your thread when it was made! Thought I'd start another one for this round. We seem to have very similar ideas on what EA is worth.
I'd like to do a similar write up for about half a dozen other companies atm but the sidebar says just one at a time. =/",z0n3,InvestmentClub,05-04-2012 02:22,3,3,0,t3_rtu9p,t1_c48mevc,,,0,0
c48nodz,i liked your write up on EA better than mine. it was much more technical and in depth and you made better points. what are your thoughts on THQ reaching $1 dollar this year?,ajsmithjr,InvestmentClub,05-04-2012 03:33,1,1,0,t3_rtu9p,t1_c48mtv9,,,0,0
c48nu7p,"Not this year. They have done a good deal of cutting dead weight. They'll be able to focus on the properties that matter instead of wasting talent on Movie adaptations and junk like that. But they don't have enough in the pipeline to have a good year. Next year, when projects started this year with the intense focus they can now give, next year will be a good year.
I'll take a deeper look later, I'm not as familiar with them because I havent seen anything to suggest that I have to buy now to make gains. If its going to go up I have time to make money with other investments first. Imo if I think a company is a hold and going to be stagnate for 9 I don't care what its future is 10 years from today, there is no need to buy immediately. If I buy that hypothetical I have an opportunity loss for those months when my investment was essentially doing nothing.

EDIT: I really like their line up.

2012

    Warhammer 40,000: Dawn of War III (Windows)[25]
    Darksiders II (PlayStation 3, Xbox 360, Wii U, Windows)
    South Park: The Game (Xbox 360, PlayStation 3, Windows)
    WWE '13 (Xbox 360, Wii, PlayStation 3)
    Unannounced Game (Wii U, Wii, PlayStation 3, Xbox 360, Nintendo 3DS)[26]
    Unannounced Game (Wii U)[27]

2013

    inSANE (PlayStation 3, Xbox 360, Windows)
    Devil's Third (PlayStation 3, Wii U, Xbox 360)
    Warhammer 40,000: Dark Millennium Online (Windows) - cancelled.
    Metro: Last Light (Xbox 360, PlayStation 3, Windows, Wii U)
    Unannounced Turtle Rock game (Xbox 360, PlayStation 3, Windows, Wii U)
",z0n3,InvestmentClub,05-04-2012 03:49,1,1,0,t3_rtu9p,t1_c48nodz,,,0,0
c48qr2o,"I like what you have here. I've been thinking similar but your discussion was waaay more in-depth than I have ever gone with stocks. (Maybe this should change, when I'm ready to invest)
Anyway another thing that I think you missed, Battlefield 3 and sports games. They have cornered the market. It's pretty much the only alternative with FPS, next to COD. Now I don't know to much about sports but they've cornered that market too. That said I'm saying it's a buy for long term. ",putaro3000,InvestmentClub,05-04-2012 11:41,2,2,0,t3_rtu9p,t3_rtu9p,,,0,0
c48rmhs,i just bought in again at 16.29 right this second. earnings is first week in may,ajsmithjr,InvestmentClub,05-04-2012 13:47,1,1,0,t3_rtu9p,t1_c48qr2o,,,0,0
c48tv2n,"I ignored BF3 and sports (except wrestling, THQ owns that market) because I was focusing on the short play and I don't think those two markets had effects on EA's performance that are not predictable. My entire thesis hinges that no one saw this high of sales and dlc coming that investors, analysts and EA have not factored in these earnings. BF3 and sports were known entities that don't appear to have reacted in any unpredicted way.

You are right though, they have done quite a good job holding onto the sports franchises. Thats pretty steady income for them. None the less I don't see EA right now as a long term play. Honestly I am hesitant about ANY media company as a long term play because they are so ephemeral. That said, if I was betting long term I would go with ATVI.
The pyramid on the first slide of the following link does a decent job explaining why. I mean talk about locking up the shooter market! :)
http://files.shareholder.com/downloads/ACTI/1767404971x0x541649/db4285e9-f49e-47e1-a410-dc56ad167e42/ATVI_CQ411ATVI_Summary_Sheet.pdf

For a more serious answer, http://files.shareholder.com/downloads/ACTI/1767404971x0x541608/d4938540-d45e-4b5b-87a9-f605bd542852/ATVI_C4Q11_Slides.pdf

The above does a great job summering how good ATVI is getting at squeezing blood from a stone. Seriously they are monetizing all their major brands in ways that draw high margin sales (DLC, Subscriptions, Mobile). Plus it pays a dividend which is attractive to some investors.",z0n3,InvestmentClub,05-04-2012 16:45,1,1,0,t3_rtu9p,t1_c48qr2o,,,0,0
c48vkk5,"I didn't realize Blizzard has a new MMO in development. Even if it crashes and burns (I doubt it), there's gonna be loads of hype based on the fact that it's a Blizzard franchise. Definitely getting some ATVI.",BrokeJawa,InvestmentClub,05-04-2012 18:49,1,1,0,t3_rtu9p,t1_c48tv2n,,,0,0
c48xe4b,EA has another MMO in the works as well.,z0n3,InvestmentClub,05-04-2012 21:07,1,1,0,t3_rtu9p,t1_c48vkk5,,,0,0
c48yddx,Jesus ATVI looks incredible compared to EAs hold. I mean COD and WOW have been two of the most popular games around the world. Thanks for the heads up :),putaro3000,InvestmentClub,05-04-2012 22:27,2,2,0,t3_rtu9p,t1_c48tv2n,,,0,0
c48yn2y,"Yeah, I already own some EA. I just started investing last month, and it was the first stock I bought. It made investing real for me, so I'll always have a place in my heart for EA, even though the thought makes me gag. 

At this point, I think buying EA was a mistake. I've come to the same conclusion that you have, they're not a long term play. For all the reasons you've listed, I'm going to hang on to them, but I don't think they have solid financials and they just seem like a really rocky company. Hopefully their earning statement for Q2 will be impressive, but I feel like I'm banking that all on Star Wars.

I like their solid lineup which is made of money making titles, and I know they also license EA Sports bars, which is pretty cool. They just seem like a company that has spread itself out really thin, and if they suffer one or two major blows, it'll knock the price down.

ATVI just seems more stable in the long term, and I don't hate them. So it would be nice to invest in them just so I have a staple video game company in my portfolio. At this point I want to build a portfolio that will raise in value over a couple years, even if I'm not making bank.",BrokeJawa,InvestmentClub,05-04-2012 22:50,2,2,0,t3_rtu9p,t1_c48xe4b,,,0,0
c491c7y,"1.  Marijuana Hype?  Get real - more people favor the legalization of Marijuana in the U.S. than those who do not.  It's a matter of time.  And when the time comes you'll be kicking yourself in the ass that you didn't invest in a company like this.  

2.  Fair.  However, most penny stocks do this - they have to do this from going under until they generate legit revenue streams.  Also, they're creating products which cost money - give it time.

3.  This is where I realized you have no idea what you're talking about.  Steve Kubby is NOT CEO - he was fired in 2010.  CBIS' CEO is Dr. Robert Melamede - who SPECIALIZES in Marijuana growth, cultivation, research, and any other thing you could possibly dream up that is associated with the plant.  He has a PHD, and is a Biology professor at the University of Colorado (Colorado being one of the most lenient states as far as MJ is concerned - therefore his research is anything but interfered with).  You think there is not a credible way this company can generate revenue?  They're making topographical ointments/solutions that DESTROY  skin cancer.  Yesterday they just confirmed that a patient of theirs is now CANCER FREE after using their ointments on an area affected by Squamous cell carcinoma.  They confirmed through their patient's doctor who conducted a biopsy.  

The only reason this company would go under is because the government is trying to hide the fact that Marijuana is a healing plant.  I could go on for days about how research over several years, scratch that, DECADES, has been conducted in independent labs to full scale university research projects which promotes the fact that Marijuana (THC) reduces growth of both benign and malignant tumors.  If a simple plant like this could cure cancer it would be worth the millions (billions?) of dollars spent by the government to keep it illegal and to fill the minds of the American population with bullshit.  /rant",FiniteRecursion,InvestmentClub,06-04-2012 02:54,0,0,0,t3_rbury,t1_c44qa5f,,,0,0
c496k63,"Your right, marijuana is a magical plant that cures cancer. Its a shame that we cant get the word out about this, because there are a lot of people whose lives could be saved.",occupybourbonst,InvestmentClub,06-04-2012 15:16,2,2,0,t3_rbury,t1_c491c7y,,,0,0
c496qws,"the price was already knocked
down. the earnings
report at the beginning of next
month should shoot the price back
up a bit. hopefully back
into the 20s",iphoneredditor,InvestmentClub,06-04-2012 15:33,2,2,0,t3_rtu9p,t1_c48yn2y,,,0,0
c49812v,yay,wintron,InvestmentClub,06-04-2012 17:25,2,2,0,t3_rtu9p,t3_rtu9p,,,0,0
c49898d,"Haha I'm not sure if that's your poor attempt at being witty/sarcastic, or if you're being serious.  I'll choose the latter.  If it's the former, do yourself a favor and do some research. ",FiniteRecursion,InvestmentClub,06-04-2012 17:44,0,0,0,t3_rbury,t1_c496k63,,,0,0
c49dr5c,"""yea""",mastrann,InvestmentClub,07-04-2012 02:10,1,1,0,t3_rtu9p,t3_rtu9p,,,0,0
c4aifne,This right here. I agree with BrokeJawa though that if their numbers disappoint... well they will have a long way to fall. I'm expecting numbers like I talk about in my OP though which would be a very good start for a march to the 20s.,z0n3,InvestmentClub,10-04-2012 09:58,0,0,0,t3_rtu9p,t1_c496qws,,,0,0
c4cstcm,"i wish somebody would answer that question....
",surfingelephants,InvestmentClub,16-04-2012 06:12,1,1,0,t3_qj6e2,t1_c3y0tur,,,0,0
c4def9t,"Yea

The unemployment rate for youth is up near 50%, their debt to GDP as reported is no where near the real levels because it doesn't include regional debt. Real debt to GDP is probably around 100%. 

I recently got some putts on EWP but I haven't been getting enough downward momentum on them. ",HoovHoovie,InvestmentClub,17-04-2012 19:09,2,2,0,t3_rnioi,t3_rnioi,,,0,0
c4dth1q,I found this [chart](http://chart.ly/ktt7nsi). Much resistance at the $15 mark. It's at this level now. Earnings first week of May. I don't know how that will go but we may be at the bottom. ,mastrann,InvestmentClub,18-04-2012 18:43,1,1,0,t3_rtu9p,t3_rtu9p,,,0,0
c4f87yl,[deleted],[deleted],InvestmentClub,22-04-2012 14:53,1,1,0,t3_rtu9p,t1_c4dth1q,,,0,0
