id,body,author,subreddit,created_datetime,score,ups,downs,link_id,parent_id,permalink,is_submitter,controversiality,gilded
c5uub7o,"Still steadily going up, still seems like a good buy.

Sorry for posting in this old thread, but was just doing a bit of research on this.",rug-muncher,InvestmentClub,18-08-2012 00:40,1,1,0,t3_ucxb8,t3_ucxb8,,,0,0
c5v6jit,You're likely to get more help if you post your question to /r/investing.,Zurevu,InvestmentClub,18-08-2012 20:46,2,2,0,t3_yeg62,t3_yeg62,,,0,0
c5v6x5n,"I'm looking for them to sell a bunch of cars. Vroom Vroom! yes I know, tsla cars dont make that much noise. ;(",twelve112,InvestmentClub,18-08-2012 21:17,2,2,0,t3_yei5b,t3_yei5b,,,0,0
c5v6zo4,Simple enough ,Icesp,InvestmentClub,18-08-2012 21:22,1,1,0,t3_yei5b,t1_c5v6x5n,,,0,0
c5v7fus,Thanks.,loudNeighbors,InvestmentClub,18-08-2012 21:57,1,1,0,t3_yeg62,t1_c5v6jit,,,0,0
c5vtnbg,"Nice analysis. Couple questions:

-I'm gonna look into this at work tomorrow, but even though there's a US-France tax treaty agreeing to a 15% withholding rate, I still think you get hit with a 30% withholding trading the ADR on a US exchange. If you're stuck with the 30% dividend rate, does this affect your analysis at all? 

-What's the story with Iliad? Looks like it's been around since '99 but from what I read it's more of an up-and-comer in the industry. You touch on this a bit in your analysis, but do you think it will pose a long-term threat to the big dogs in the French telecom industry? It sounds like for the time being Iliad has a fundamentally different strategy in pursuing lower-end subscribers, but do they have plans to expand beyond that and really go after FTE and the others? ",turkeyandpesto,InvestmentClub,20-08-2012 05:11,1,1,0,t3_y11gk,t3_y11gk,,,0,0
c5wa5ga,"&gt;-I'm gonna look into this at work tomorrow, but even though there's a US-France tax treaty agreeing to a 15% withholding rate, I still think you get hit with a 30% withholding trading the ADR on a US exchange. If you're stuck with the 30% dividend rate, does this affect your analysis at all? 

It does affect it by a small amount, but I'm basically certain that you get the 15% tax rate, so long as you either manually fill out the IRS forms for the tax treaty, or have a broker that automatically does it for you (I know TD does this)

&gt;-What's the story with Iliad? Looks like it's been around since '99 but from what I read it's more of an up-and-comer in the industry. You touch on this a bit in your analysis, but do you think it will pose a long-term threat to the big dogs in the French telecom industry? It sounds like for the time being Iliad has a fundamentally different strategy in pursuing lower-end subscribers, but do they have plans to expand beyond that and really go after FTE and the others? 

Iliad has been around a long time, but its primary business has always been internet. Only in January of 2012 did Iliad expand into the mobile services business with *Iliad Free*: a low-cost, sim-only plan. I do not believe Iliad will be a long term threat for several reasons:

- Various reports by major consulting/finance firms, such as Booz, E&amp;Y, and Morningstar, predict that the market for low-cost mobile subscribers to shrink to higher-cost, more tech-advanced smartphones. (see page 3 of [this](http://aiti.mit.edu/media/programs/colombia-summer-2012/materials/booz&amp;co_gsma-2012_futurecmt.pdf) report).

- It doesn't have the infrastructure currently in place to garner significant market share. It has a contract w/ FTE where FTE provides coverage for Ilian subscribers where there are no Iliad towers in exchange for very high roaming fees. This is a very lucrative contract for FTE.

- Market saturation already exceeds 100% in France, and, past studies have shown, at those levels of market saturation, when a new entrant enters the market, most of their customer base will come from converting fixed-line customers, but it is extremely difficult to steal significant market-share from pre-existing companies. Case studies of similar ventures in Japan, Germany, and other markets have all been met with failure.",benyBC,InvestmentClub,21-08-2012 01:53,2,2,0,t3_y11gk,t1_c5vtnbg,,,0,0
c5xbwr9,[deleted],[deleted],InvestmentClub,23-08-2012 01:48,1,1,0,t3_y11gk,t1_c5wa5ga,,,0,0
c5xc5wj,"That means you basically gave away free money, because Scottrade didn't file the form for you, and I guess you didn't file it yourself either.:

http://www.irs.gov/pub/irs-trty/france.pdf

Page 12, Article 10.2(b):

Such dividends may also be taxed... the tax so charged shall not exceed: ... 15 percent of the gross amount of the dividends.

I believe this is the form to use if you want to reclaim your money:

http://www.irs.gov/pub/irs-pdf/f1116.pdf",benyBC,InvestmentClub,23-08-2012 02:05,5,5,0,t3_y11gk,t1_c5xbwr9,,,0,0
c5xps7j,[deleted],[deleted],InvestmentClub,23-08-2012 20:19,1,1,0,t3_yo73v,t3_yo73v,,,0,0
c5yqpmi,why don't you sell some covered calls if you decide to sell?,[deleted],InvestmentClub,25-08-2012 23:16,1,1,0,t3_x0q8w,t3_x0q8w,,,0,0
c5yyywq,"I see no reason for a buy or sell in that thread. This isn't an investment, it's a straight up guess.",throw-it-out,InvestmentClub,26-08-2012 14:05,2,2,0,t3_yo73v,t3_yo73v,,,0,0
c5yz9js,i think the logical answer would be how the graph is looking and market trend to be honest... how was the sales earnings etc last quarter is also a fundemental thing to consider...but in the end a 40% profit would sit good with me and i would raise my stop/loss order around the 30% mark be happy with that and hopefully it will go higher than 40 :)...but this is just my personal preference hope it helps,runi21,InvestmentClub,26-08-2012 14:38,1,1,0,t3_x0q8w,t3_x0q8w,,,0,0
c5yzcdv,"This pick has achieved more than 10 votes and greater than 60% positive rating. I will purchase $50,000 worth of shares on Monday.",Zurevu,InvestmentClub,26-08-2012 14:46,2,2,0,t3_y11gk,t3_y11gk,,,0,0
c5yzh7j,It's also too heavily correlated with TSLA for comfort,Elitist_Circle_Jerk,InvestmentClub,26-08-2012 14:59,1,1,0,t3_yo73v,t3_yo73v,,,0,0
c5z53rn,"I haven't bought them, and I don't plan on it in the future.",theorymeltfool,InvestmentClub,26-08-2012 21:58,0,0,0,t3_yei5b,t3_yei5b,,,0,0
c5z6gsy,Why not?,Icesp,InvestmentClub,26-08-2012 23:35,1,1,0,t3_yei5b,t1_c5z53rn,,,0,0
c5zeg0n,"* I don't see too bright of a future for cars overall. I think more and more people are doing without them, living in dense urban areas, biking/using buses and subways, etc.

* With the adoption of Google Cars, i think more and more people are going to choose to forego ownership, which will decrease the # of cars on the road significantly.

* For an auto company, I'm invested in Westport Innovations (WPRT) which creates engine modifiers so that they can run on natural gas, which is an area that I see much more growth in since we're getting better and better at extracting and transporting LNG. (Up about 50% since i purchased, versus 10% for TSLA in the same period).

* I know Tesla was able to make some high-end cars, but i don't think they'll be able to translate this into efficient small cars that cost less than $20,000.

So TSLA is on my watch-list, but i haven't purchased yet.",theorymeltfool,InvestmentClub,27-08-2012 11:55,1,1,0,t3_yei5b,t1_c5z6gsy,,,0,0
c5zjyc0,"Relatively new to investing so maybe I don't know what I'm talking about, but their revenue growth looks bleak (as in non-existent at this point), and an EPS of -3.2 is unsettling. Looking at their financials, they're hemorrhaging money. 

Large numbers invested in R&amp;D, so maybe there's hope. But looking to the future, why buy an electric car from TSLA when the other major automotive producers are in the game as well?

And stock price up over the year despite all this? Bubble?",orestmercator,InvestmentClub,27-08-2012 18:44,3,3,0,t3_yei5b,t3_yei5b,,,0,0
c5zkbki,"If you look at the transaction history, you'll see that we did sell shorts and stock. Maybe not as much as you'd like, but never the less we did do it.

If you think we should take some position let /r/InvestmentClub know!",Zurevu,InvestmentClub,27-08-2012 19:06,5,5,0,t3_ywlgr,t3_ywlgr,,,0,0
c5zkpqs,Good points all around. Eye opening. ,Icesp,InvestmentClub,27-08-2012 19:31,1,1,0,t3_yei5b,t1_c5zjyc0,,,0,0
c5zkq8j,Thank you. Everything really seems to hinge on them producing a low cost/attractive car. ,Icesp,InvestmentClub,27-08-2012 19:31,1,1,0,t3_yei5b,t1_c5zeg0n,,,0,0
c5zmm7w,"When do you think you'd like to sell FTE? Also, would let your google docs pitch be visible to everybody?",Zurevu,InvestmentClub,27-08-2012 21:26,2,2,0,t3_y11gk,t3_y11gk,,,0,0
c5zrnt6,"Check this website, it gives an insight about brokers and it gives signals everyday. I find it pretty helpful
http://www.brokersignals.com/",karenazaria,InvestmentClub,28-08-2012 02:58,0,0,0,t3_yeg62,t3_yeg62,,,0,0
c5zx4nw,"I'm a long term investor, although I have been trying to learn more about shorting and other options. So far, holding stocks for the long term has beaten the markets for me.",theorymeltfool,InvestmentClub,28-08-2012 12:53,2,2,0,t3_ywlgr,t3_ywlgr,,,0,0
c62sygh,"If you like SLB, you might be interested in a smaller play based out of Canada, ESN.  Similar business but smaller (286M mkt cap), they have a great balance sheet, are focused on oil rigs, pay a great dividend and have some strong recommendations from analysts.  Could be a potential take-out.",lifeundergrad,InvestmentClub,03-09-2012 14:46,2,2,0,t3_x422q,t3_x422q,,,0,0
c63dtm1,"Cutting your losses and limiting your gains is the most difficult to cultivate skill in investment.  It means living with regrets from bad days that got better and good days that could have soared, but it also means removing ego from the equation.",80808080,InvestmentClub,04-09-2012 18:32,2,2,0,t3_x0q8w,t3_x0q8w,,,0,0
c63e0ej,Thank you! I'll look into that one.,Commodore_Tea_Leaf,InvestmentClub,04-09-2012 18:44,1,1,0,t3_x422q,t1_c62sygh,,,0,0
c64jgu7,"Interactivebrokers is by far the best in terms of commissions and global reach. You'll have access to tonnes of global markets through their platform and be paying very small fees. It doesn't have a very good analysis platform, having said all that.

Amibroker is a good piece of software for analysis but it costs about $200. Having said that you can package it with a brokerage firm for the same price and enjoy some great charting and technical analysis. 

Just go through and do some research about how your money is actually treated when picking a brokerage firm. Some will use your money, some will play around with margin accounts and so on..

I'd suggest IB though, personally. Unless you're looking at just trading domestically, in which case you might find a local brokerage to suffice (at higher commissions though, i'm sure).",Rhysee,InvestmentClub,06-09-2012 23:56,1,1,0,t3_yeg62,t3_yeg62,,,0,0
c64k9mv,"just curious, did you follow your own advice and research with own money?",[deleted],InvestmentClub,07-09-2012 00:51,3,3,0,t3_zh7xv,t3_zh7xv,,,0,0
c64kfxz,"I should really add full disclosures but never did because I have not bought any of the stocks that I have recommended. I reside in Canada and do not trade on US stock exchanges.

Thus, I feel these brief posts are unbiased investment opinions. If I did reside in the U.S., I probably would invest in these. (Also, I know I could buy U.S. stocks, but I'm just too lazy to deal with the currency conversions and stuff like that.)",bgritzut,InvestmentClub,07-09-2012 01:03,3,3,0,t3_zh7xv,t1_c64k9mv,,,0,0
c64lsyn,canadian cash is currently worth a bit more correct? you should really follow your own advice you know what youre doing and you know that lol,DeceptiStang,InvestmentClub,07-09-2012 02:30,3,3,0,t3_zh7xv,t1_c64kfxz,,,0,0
c6505m2,"Seems that a company like this would be heavily affected by the American drought. I'd maybe wait till after earnings.
",Elitist_Circle_Jerk,InvestmentClub,07-09-2012 21:57,1,1,0,t3_zh7xv,t3_zh7xv,,,0,0
c68ul37,[deleted],[deleted],InvestmentClub,16-09-2012 06:45,1,1,0,t3_zh7xv,t1_c64kfxz,,,0,0
c69wr21,"I say it is a don't buy. One of it's main products is HFCS, and it has been taking a huge hit lately with many other food companies trying to remove it from their products. Another large concern I have is that ADM operates on an extremely narrow profit margin and most of their raw materials are corn and soybeans, agricultural products heavily dependent on government subsidies.

Reading their 10K filed this year, I'm also even more concerned by the lackluster predictions on future earnings, the fear of increasing prices on seeds, loss in corn processing (one of their main business). All in all, this would not be a stock I would purchase.",hydroplatypus,InvestmentClub,18-09-2012 14:10,2,2,0,t3_zh7xv,t3_zh7xv,,,0,0
c69y7q3,"ADM has more than 10 votes and a rating greater than 60%. I will buy ADM today or tomorrow. Congrats to bgritzut.

bgritzut, when would you like to sell ADM?",Zurevu,InvestmentClub,18-09-2012 15:57,3,3,0,t3_zh7xv,t3_zh7xv,,,0,0
c6akrth,"dont know about sprint (werent they in talks to merge with att or was that t-mobile? anyways the gov cut that off)


apple has a P/E of around 16 right now and i think 2 things

1. apple has enough company wide talent to survive without the legendary steve jobs and do him proud in the future
2. apple has room to run especially with this mystical apple TV we keep hearing about that could really help revolutionize one of our last, and currently outdated industries-TV subscription.

problem is 700/share is a lot of dough but you should get in while the getting is good because it will only get higher from here, plus there could be incoming dividends from this stock

my advice would be to pick some up, disclosure, i have some too =). this is what i think.",DeceptiStang,InvestmentClub,19-09-2012 20:24,2,2,0,t3_105di1,t3_105di1,,,0,0
c6aol1o,"If you have no thesis for either, then no, neither is a good idea.",MistaSchlong,InvestmentClub,20-09-2012 00:34,3,3,0,t3_105di1,t3_105di1,,,0,0
c6bbrgs,What mystical apple tv are you talking about? It's been out for years. Each time they release with very few new features. My family has one and all we do is stream netflix. Which we could already do from the PS3. Or ipad. or computer...,angrybearD,InvestmentClub,21-09-2012 09:29,1,1,0,t3_105di1,t1_c6akrth,,,0,0
c6bfnnu,Don't be so rude.,[deleted],InvestmentClub,21-09-2012 16:13,-4,-4,0,t3_105di1,t1_c6bbrgs,,,0,0
c6bfr5o,I think you're hearing something that's not there. Mystical was his wording. The rest is just your interpretation. ,angrybearD,InvestmentClub,21-09-2012 16:20,3,3,0,t3_105di1,t1_c6bfnnu,,,0,0
c6bpbk9,"Those are all valid points in any company, but TSLA came in a little differently. They basically said before their IPO: ""hey we are losing a lot of money, but we have some awesome technology and think we can make it profitable within 10 years.""

Electric cars are likely the future, and TSLA is pretty much the only company with a serious attempt at it. You're absolutely right on all accounts, but the profit potential is enormous, and they'd be years ahead of the competition if they ever nailed down this whole electric car thing.

Bottomline is this company is worth 10x the price its going for now if it can ever achieve its goal. IMO this is not a company for regular folks to invest in. It's a gamble.",fiduke,InvestmentClub,22-09-2012 03:37,3,3,0,t3_yei5b,t1_c5zjyc0,,,0,0
c6c3rcw,there is talk about a canadian real estate bubble. how do you factor that into your recommendation?,slackie911,InvestmentClub,23-09-2012 04:27,1,1,0,t3_10873u,t3_10873u,,,0,0
c6c7st7,"I'd personally buy BNS and get the dividend for this quarter then phase it out by December as I mentioned in the Note (or hedge it out using options if I wanted to maintain the dividend). I don't foresee any big collapse within the next couple months.

My opinion on Canadian real estate is not very credible, but I personally don't think we will see a big collapse as we did in the US. If anything, it will probably be more of a soft landing. I can't back this up with anything however, just my personal opinion.",bgritzut,InvestmentClub,23-09-2012 14:17,2,2,0,t3_10873u,t1_c6c3rcw,,,0,0
c6d9ugq,"Interesting. I'm torn on buying Tesla. I'm absolutely positive that electric cars are here to stay this time around-- I'm just not sure if Tesla is going to lead the way. If Tesla proves to be an emerging electric vehicle manufacturer, then these coming quarters will be a great opportunity to buy at a significant discount. ",aydoaris,InvestmentClub,25-09-2012 17:30,0,0,0,t3_10g1v0,t3_10g1v0,,,0,0
c6db0z5,"I purchased a few thousand shares at 28. I'm convinced that TSLA has the cash reserves to make this happen, and has licensed drivetrain technology to all other commercial electrics and some hybrids. They are positioned for the long-haul, but sales of the S need to pick up in the next year. On this last point - I'm confident that the rollout of their free charging service paired with an electric car design that looks like a car instead of some shitty Jetson's car - or anything remotely similar to the Prius - will excite some buyers. TSLA seems to have given slow market penetration some thought, given the spread of features from entry (54k) to luxury (105k), before US subsidies take the edge off.",xnoybis,InvestmentClub,25-09-2012 18:40,2,2,0,t3_10g1v0,t3_10g1v0,,,0,0
c6dqkjn,Please don't link stuff from the Fool.  They have no fucking clue what they are talking about.,[deleted],InvestmentClub,26-09-2012 16:15,2,2,0,t3_10gtln,t3_10gtln,,,0,0
c6g9qzd,This recommendation did not receive the required minimum of 10 votes. Therefore it will not be purchased.,Zurevu,InvestmentClub,02-10-2012 02:17,1,1,0,t3_10873u,t3_10873u,,,0,0
c6goxts,What site do you recommend? I've been using them for a while and have seen good returns.,theorymeltfool,InvestmentClub,02-10-2012 22:28,2,2,0,t3_10gtln,t1_c6dqkjn,,,0,0
c6gq0n0,"I don't recommend any site.  If there is news about an investment, that means all the truly smart people have already picked up on it.  Do your own research.",[deleted],InvestmentClub,02-10-2012 23:33,1,1,0,t3_10gtln,t1_c6goxts,,,0,0
c6gq9pg,"&gt; If there is news about an investment, that means all the truly smart people have already picked up on it.

But that doesn't mean that it isn't a good idea, or that everyone acted on it, or that it'll go much higher 5 years from now. 

The only other way to 'do my own research' would be to look at each company and spend hours going through data points to find little bits of information that i could potentially capitalize on. Since I don't have enough invested to do this full time, and I have a full time job that currently pays more than the ROI from my investment portfolio, I think it's much better to outsource this task to other sites, like Motley fool. For example, I paid $200 for one of their newsletters, and so far I've made about $2500 in returns on my investments. Not a bad ROI if you ask me, and much less expensive than spending hours every day looking for things that no one else in the entire world has noticed.",theorymeltfool,InvestmentClub,02-10-2012 23:48,3,3,0,t3_10gtln,t1_c6gq0n0,,,0,0
c6ha1lz,"Motley Fool has some decent info but for the most part is terrible and scammy and in this case I believe there is a pretty large future in 3D printing but at the current prices I'm not buying these companies. I'd wait for a small to medium pullback than jump in.

The problem is sites like that are very much a gamble and are usually selling something (like premiums on motley fool) or invested in something personally than write an article justifying it (seeking alpha for the most part, they are at least a little better than Motley Fool in general however.). Some of them are ok but for the most part identifying stocks in sectors you understand and think have potential, analyzing these companies products for competitive advantages and growth and than analyzing their financials for stability, growth, potentially dividends will help you pick stocks that are at least solid and than you can reading quarterly and annual reports and general news on the stock to keep up to date. At least that's what works for me.

Good luck",zawmbie5,InvestmentClub,04-10-2012 00:12,2,2,0,t3_10gtln,t1_c6goxts,,,0,0
c6hcfi7,"Agreed. I don't always listen to motley fool, but I will research the companies that they recommend. I Think it helps to narrow down the field a bit.",theorymeltfool,InvestmentClub,04-10-2012 02:44,2,2,0,t3_10gtln,t1_c6ha1lz,,,0,0
c6hx573,Totaly fool...,kaiethan,InvestmentClub,05-10-2012 06:10,0,0,0,t3_10gtln,t3_10gtln,,,0,0
c6i9ngh,"Here's what I promised myself to do, and was 100% sure I was mentally going to do it before I dropped my first buck.

1. I will set the price targets and act according to my research and beliefs.
2. Once the trade is completed, NO REGRETS.",Lab_Ratting,InvestmentClub,06-10-2012 00:03,2,2,0,t3_x0q8w,t1_c63dtm1,,,0,0
c6ie3vo,the two companies will create a major force in the 3D printing,Nenik,InvestmentClub,06-10-2012 06:17,1,1,0,t3_10gtln,t3_10gtln,,,0,0
c6jfmpo,"I agree with venividivixi, but good ideas can go geometric - Apple is a great case in point. I bought stock around 25US. More and more people claim it's a great company, but that doesn't mean I don't reinvest when the stock drops from 710US to 640US.",xnoybis,InvestmentClub,08-10-2012 17:26,1,1,0,t3_10gtln,t1_c6gq9pg,,,0,0
c6jxwv5,[deleted],[deleted],InvestmentClub,09-10-2012 17:10,1,1,0,t3_x0q8w,t1_c63dtm1,,,0,0
c6kgwg0,"A stock screener would be an excellent tool!

CLF/VNR is things i really like.",knowledgemule,InvestmentClub,10-10-2012 17:53,2,2,0,t3_1199nk,t3_1199nk,,,0,0
c6kiwgo,"if you want the easiest stock for fundamental analysis, it will have to be a blue chip or something that's stable.  fondamental analysis is sometimes iffy with newer companies.  it's still doable though.",jabroni2002,InvestmentClub,10-10-2012 19:48,2,2,0,t3_1199nk,t3_1199nk,,,0,0
c6kkxn7,"for your purposes i would like a mid size company with 1 main line of business in a growth field.  Conglomerates can be quite complicated and generally have low growth rates.  Start ups and tech companies can be equally complicated in other ways.

also, i would think about an end game.  What is going to happen to the company.  grow real big, be acquired, reach a slower growth stage... 

here are 2 i like in the assisted living space. It is important to understand how these companies finance their growth.  
BKD - growing fast and one of the largest players in the space
ALC - acquisition target, lawsuits pending depressing valuation. 
",kirbs2001,InvestmentClub,10-10-2012 21:43,3,3,0,t3_1199nk,t3_1199nk,,,0,0
c6kl9kh,"Becton, Dickinson and Company (NYSE: BDX)?

It's a big healthcare company that many would not have heard of if they aren't in the medical or investment industry.

",bgritzut,InvestmentClub,10-10-2012 22:03,1,1,0,t3_1199nk,t3_1199nk,,,0,0
c6kmbuy,the /r/investing stock picks for the month is a fun list to look through for ideas. A lot of volatile picks though.,theHomers,InvestmentClub,10-10-2012 23:09,1,1,0,t3_1199nk,t3_1199nk,,,0,0
c6nddmw,tips are for waiters bro,twelve112,InvestmentClub,16-10-2012 18:18,3,3,0,t3_11jhs1,t3_11jhs1,,,0,0
c6wkhhz,[deleted],[deleted],InvestmentClub,05-11-2012 04:18,1,1,0,t3_12nftf,t3_12nftf,,,0,0
c6wqdgv,[deleted],[deleted],InvestmentClub,05-11-2012 15:27,1,1,0,t3_101gzp,t3_101gzp,,,0,0
c6xjsmx,"measuring while drilling is drilling, dog, i work here and you forgot to mention hydraulic fracturing as one of its biggest moneymakers.",nugget954,InvestmentClub,07-11-2012 01:29,1,1,0,t3_x422q,t1_c5kxjlm,,,0,0
c6xo6lj,"orly I think of a drilling engineer as generally being more practical and less oriented toward logging and shit but maybe that's not right [i do not know a lot about drilling]

also while fracking is undeniably a moneymaker, I do know that D&amp;M and wireline are #1 and #2",barbadosslim,InvestmentClub,07-11-2012 06:25,1,1,0,t3_x422q,t1_c6xjsmx,,,0,0
c6xtcaq,"well regardless, there goes the stock market... god help us all
",nugget954,InvestmentClub,07-11-2012 16:16,1,1,0,t3_x422q,t1_c6xo6lj,,,0,0
c6xteq2,why's that dog,barbadosslim,InvestmentClub,07-11-2012 16:20,1,1,0,t3_x422q,t1_c6xtcaq,,,0,0
c6xyj4l,"dat boi obama's killin the stock game (literally)
",nugget954,InvestmentClub,07-11-2012 21:09,1,1,0,t3_x422q,t1_c6xteq2,,,0,0
c70941d,"This is a value trap.  I analyzed Xerox last year after hearing a suggestion from Tony Scaramucci.  He bought I believe, but my research showed it to be crap.

The copy business is going down because paper use is declining.  This is fine on the surface, because Xerox wants to go into the maintenance business instead of the selling-copy-machines business, but more businesses are looking at alternative solutions (e.g., sharing a used machine rather than buying a dedicated new machine).

With respect to the EZ pass system they maintain: it's tech.  The problem is that the author here does not understand that Xerox's competitors aren't Dell or HP per se, but other manufacturers of copiers: Canon, for instance.  The problem with the R&amp;D in this type of business is that tech improves by leaps, meaning if Xerox has the best tech today, someone else will have the best tech next year (and hence win all the contracts).  Then, someone else still will have even better tech five years from now.  This is part of why the future cash flows are discounted so heavily in the stock.
",MistaSchlong,InvestmentClub,12-11-2012 17:38,2,2,0,t3_130u1k,t3_130u1k,,,0,0
c724gxx,"hope u didn't get any apple stock, its at 520 now. ",awesomexpossum,InvestmentClub,16-11-2012 03:48,2,2,0,t3_105di1,t3_105di1,,,0,0
c72avau,[deleted],[deleted],InvestmentClub,16-11-2012 15:13,1,1,0,t3_105di1,t1_c724gxx,,,0,0
c72b8m0,[deleted],[deleted],InvestmentClub,16-11-2012 15:39,1,1,0,t3_130u1k,t1_c70941d,,,0,0
