id,body,author,subreddit,created_datetime,score,ups,downs,link_id,parent_id,permalink,is_submitter,controversiality,gilded
c3mvgkg,I think this is a great idea!,hobbitskill,InvestmentClub,01-02-2012 18:13,2,2,0,t3_p6dut,t3_p6dut,,,0,0
c3mvhfc,what he/she said^!!,withacupofcoffee,InvestmentClub,01-02-2012 18:15,1,1,0,t3_p6dut,t1_c3mvgkg,,,0,0
c3mw780,"Which simulator are you going to use, the only reason why I ask is because I know some don't allow you to buy penny stocks.  Can we suggest penny stocks?",hobbitskill,InvestmentClub,01-02-2012 19:14,1,1,0,t3_p6dut,t3_p6dut,,,0,0
c3mwiu4,It depends on everybody's vote but I'm guessing that we won't be buying penny stocks. I'll have to check if the simulator can buy penny stocks. ,Zurevu,InvestmentClub,01-02-2012 19:41,1,1,0,t3_p6dut,t1_c3mw780,,,0,0
c3mwngt,Ticker: CHK,AutonomousMonkey,InvestmentClub,01-02-2012 19:51,2,2,0,t3_p6jm5,t3_p6jm5,,,0,0
c3mx01m,"FYI please discuss only one stock per posting. Thanks!

Edit: It makes it hard to know which company people are voting for.",Zurevu,InvestmentClub,01-02-2012 20:20,1,1,0,t3_p6fpo,t3_p6fpo,,,0,0
c3mxe3c,"Would like to chime in and say that while coal shipments are down due to cheap natural gas and warmer weather than usual (thus less need for coal powered electricity), I don't think it's a long term game changer for any of the transportation industries.  Good buy for long term, IMO.",keezel,InvestmentClub,01-02-2012 20:51,3,3,0,t3_p6ll4,t3_p6ll4,,,0,0
c3mxgl3,She's due in September.,[deleted],InvestmentClub,01-02-2012 20:56,1,1,0,t3_p6dut,t1_c3mvhfc,,,0,0
c3my00l,[deleted],[deleted],InvestmentClub,01-02-2012 21:39,0,0,0,t3_p6jm5,t3_p6jm5,,,0,0
c3my0di,Is it too soon to call this my new favorite subreddit?,Workahol,InvestmentClub,01-02-2012 21:40,4,4,0,t3_p6dut,t3_p6dut,,,0,0
c3my0qm,What exchanges are we looking at? Only US?,[deleted],InvestmentClub,01-02-2012 21:41,1,1,0,t3_p6dut,t3_p6dut,,,0,0
c3my2qh,"Yes, US only.",Zurevu,InvestmentClub,01-02-2012 21:45,1,1,0,t3_p6dut,t1_c3my0qm,,,0,0
c3my4wy,"Yes, it's too soon. If you have any ideas on how to improve it or make it work better, please let me know.

edit: By too soon, I mean that all previous investment clubs on reddit have failed.",Zurevu,InvestmentClub,01-02-2012 21:50,2,2,0,t3_p6dut,t1_c3my0di,,,0,0
c3my5wl,"I disagree! I was an investor in EV Energy Partners (EVEP), another Ohio Shale Natural Gas company. I sold out of it recently, albeit with minimal return. What happened is that there has been an immense discovery of natural gas. Way more than expected. As such, supply has soared, thus underpricing the price per cubic foot. As such, companies will be able to get much less per cubic foot than expected. Analysts are overpricing the price at which they will be selling at. As such, I would shy away from CHK.",[deleted],InvestmentClub,01-02-2012 21:52,3,3,0,t3_p6jm5,t3_p6jm5,,,0,0
c3myiwx,"Stock simulators do not include dividends, sucks. I know about AGNC though, it is really a great dividend stock, and they can actually afford it.",ttg314,InvestmentClub,01-02-2012 22:23,2,2,0,t3_p6qgm,t3_p6qgm,,,0,0
c3myj28,"I agree with what you said with the immense discovery of natural gas undervaluing gas prices, but CHK has been trying to combat gas prices from lowering. Also they are constantly reinventing new procedures for hydro fracking and the use of oil sands. ",AutonomousMonkey,InvestmentClub,01-02-2012 22:24,1,1,0,t3_p6jm5,t1_c3my5wl,,,0,0
c3mylp9,what financial services do they offer? ,AutonomousMonkey,InvestmentClub,01-02-2012 22:30,1,1,0,t3_p6mhb,t3_p6mhb,,,0,0
c3myn2t,"I personally like Marathon Oil Corporation (MGO). They have a huge stake in North Dakota. Because of a huge sell off, right now it is extremely cheap, and there is so much potential in this company. I recently read the Annual Report and it's safe to say this company is way undervalued. But I do like the oil market (especially US hydrofracking) is general.",ttg314,InvestmentClub,01-02-2012 22:33,1,1,0,t3_p6jm5,t3_p6jm5,,,0,0
c3myndw,Well I plan on using this as a continuous learning tool for my own portfolio. I'll see what I can do to help out in the future.,Workahol,InvestmentClub,01-02-2012 22:34,1,1,0,t3_p6dut,t1_c3my4wy,,,0,0
c3mynuc,"What about futures, gold, etc...?",kc_ack,InvestmentClub,01-02-2012 22:35,2,2,0,t3_p6dut,t3_p6dut,,,0,0
c3myomt,Only in the form of ETFs.,Zurevu,InvestmentClub,01-02-2012 22:37,2,2,0,t3_p6dut,t1_c3mynuc,,,0,0
c3myu5h,"Hmm, that's odd.   Is there a post somewhere with the complete rules and restrictions?

Anyway, what's the deal with short positions and options then?  Because if the simulation ignores dividends entirely you can probably make some fast money taking short positions around the ex dividend date for this company and a few of the other high yield stocks.",Waterwoo,InvestmentClub,01-02-2012 22:51,1,1,0,t3_p6qgm,t1_c3myiwx,,,0,0
c3myyip,"There probably is.

Trading is delayed 20 minuts usually. You probably can if you wanted to, kind of takes the fun out of the game though because it's basically cheating. 

Also, dividend price don't always reflect the price decrease. People think the price is manually set lower after the payout. Not true. Market usually just takes into consideration the loss in assets.

The only way you can take into account dividends in a virtual portfolio is to create an excel worksheet.",ttg314,InvestmentClub,01-02-2012 23:02,1,1,0,t3_p6qgm,t1_c3myu5h,,,0,0
c3mz34w,"From http://www.google.com/finance?q=NYSE:SNV

""Synovus Financial Corp. (Synovus) is a financial services company and a registered bank holding company. The Company provides integrated financial services, including commercial and retail banking, financial management, insurance and mortgage services to its customers through 30 locally branded banking divisions of its wholly owned subsidiary bank, Synovus Bank, and other offices in Georgia, Alabama, South Carolina, Florida and Tennessee. As of December 31, 2010, its total loans were $21.6 billion. Synovus conducts its banking operations through Synovus Bank. Synovus Bank is a state-chartered bank. Synovus Bank operates through 30 locally branded bank divisions throughout Alabama, Florida, Georgia, South Carolina and Tennessee. Synovus Bank offers commercial banking services and retail banking services.""",Delepie,InvestmentClub,01-02-2012 23:13,1,1,0,t3_p6mhb,t3_p6mhb,,,0,0
c3mz4mw,"I am not a professional trader but do have a fairly extensive education background in finance.

I'm aware that nobody manually sets the price lower on the ex-dividend date, but it is a VERY strong relationship, and reflects not just the exit of assets from the company, but more directly the reduced expected cash flows from the stock by the dividend amount.

As for cheating..  well that's a debatable point in my opinion.  Maybe we should vote on it.",Waterwoo,InvestmentClub,01-02-2012 23:17,1,1,0,t3_p6qgm,t1_c3myyip,,,0,0
c3mz77p,"if you search REIT in the investing subreddit you'll see some analysis of AGNC. A lot of people are steering clear because it's a leveraged REIT, and it has a lot of debt on it's books.",PeterBraden,InvestmentClub,01-02-2012 23:24,2,2,0,t3_p6qgm,t3_p6qgm,,,0,0
c3mz8s3,"Clean Energy Fuels (CLNE) is a good company with good growth prospects.  They are partnered with Chesapeake, but I think CLNE is a better play.",bobbyt2012,InvestmentClub,01-02-2012 23:28,2,2,0,t3_p6jm5,t3_p6jm5,,,0,0
c3mzeye,"Yes I know.

But it is defiantly cheating, because you can't do it in the ""real world"" The fun of a simulation is to see how much return you can get.",ttg314,InvestmentClub,01-02-2012 23:43,1,1,0,t3_p6qgm,t1_c3mz4mw,,,0,0
c3mzhsw,"So is this trading or investing, and is this with US shares only?",mazikeenwantsme,InvestmentClub,01-02-2012 23:50,1,1,0,t3_p6uck,t3_p6uck,,,0,0
c3n00mk,"I'm still hating myself for buying CAT in March of '09 at 30, only to panic and sell it that June for 38...ugh if I'd just kept it!! :)

That being said, I'm skeptical about 145. Maybe if it dips below 100 I'll get my feet wet again.

Apple just hit all-time highs. Really wanna buy now?",behemuthm,InvestmentClub,02-02-2012 00:39,1,1,0,t3_p6mp2,t3_p6mp2,,,0,0
c3n0i1l,"Good company but I'm bearish b/c of low natgas prices and the fact that they got rid of all their hedges. Same thing with Encana (TSX:ECA), although they're hedged at higher prices through 2012. I just don't see any upside in natural gas prices for the short/medium term.",mikew1200,InvestmentClub,02-02-2012 01:28,1,1,0,t3_p6jm5,t3_p6jm5,,,0,0
c3n0ryd,"I'm not sure how stocks should be added, but I like the ""bad pick of the month"". This would also give us an opportunity to learn from the poorer decisions to hopefully understand what went wrong. ",Delepie,InvestmentClub,02-02-2012 01:54,3,3,0,t3_p6wz2,t3_p6wz2,,,0,0
c3n10z8,Something like thinkorswim paper money? Not even sure how that would work,kirbs2001,InvestmentClub,02-02-2012 02:18,1,1,0,t3_p6wz2,t3_p6wz2,,,0,0
c3n1co6,Can you explain what method you used for valuation? Interested,hairygummybear,InvestmentClub,02-02-2012 02:49,1,1,0,t3_p6r70,t3_p6r70,,,0,0
c3n1fuv,"We shouldn't let any bad stocks get in there in the first place.

Do agree on rules though, we need some of em'.",ttg314,InvestmentClub,02-02-2012 02:57,2,2,0,t3_p6wz2,t3_p6wz2,,,0,0
c3n1iuh,Discounted cash flow model. I have a couple templates I created if your interested.,ttg314,InvestmentClub,02-02-2012 03:05,1,1,0,t3_p6r70,t1_c3n1co6,,,0,0
c3n2m14,"This isn't risk, this is throwing your money away. Just another pink sheet pump and dump",ttg314,InvestmentClub,02-02-2012 04:44,3,3,0,t3_p6u55,t3_p6u55,,,0,0
c3n3c3f,"*...and make fun of the person that picked it!*

j/k",skorsak,InvestmentClub,02-02-2012 05:56,3,3,0,t3_p6wz2,t1_c3n0ryd,,,0,0
c3n3dg3,"I say we keep titles consistent.

Company Name [ticker symbol]

eg. Apple Inc. [AAPL]",skorsak,InvestmentClub,02-02-2012 06:00,6,6,0,t3_p6dut,t3_p6dut,,,0,0
c3n3i6r,"Most energy companies are lowering their output of natural gas.  This is due to the very low prices.  Apparently, the gas is more valuable to them while its still in the ground.  I'm not touching any energy stock that deals with natural gas for quite some time.",OMGNoMNoMNoM,InvestmentClub,02-02-2012 06:15,2,2,0,t3_p6jm5,t3_p6jm5,,,0,0
c3n3thg,[deleted],[deleted],InvestmentClub,02-02-2012 06:54,1,1,0,t3_p6r70,t1_c3n1iuh,,,0,0
c3n40mm,"What you're looking for is also an investment mandate. (eg. what the fund is able to invest in and what %)
Might want to think about exchanges (ie US stocks only?)
permitted stocks -eg. S&amp;P 500 only or whatever, no penny stocks, can it trade derivatives (eg. futures/options)
Can one use stop losses/profit takes?
The ""bad investment"" does it get sold off and re-invested in proportion to the weighing of the rest of the stocks or a totally new stock?",fraudster,InvestmentClub,02-02-2012 07:22,2,2,0,t3_p6wz2,t3_p6wz2,,,0,0
c3n47jw,I'm interested too. ,Jax3R,InvestmentClub,02-02-2012 07:52,1,1,0,t3_p6r70,t1_c3n1iuh,,,0,0
c3n48kt,"Doesn't it face serious competition from the big internet companies, Google, Facebook, Conde Nast, etc. etc. I could see the small website that they own being put out by the bigger guys, especially if any SOPA/PIPA legislature gets passed. ",Jax3R,InvestmentClub,02-02-2012 07:57,3,3,0,t3_p6r70,t3_p6r70,,,0,0
c3n4d4s,"What the fuck is their ""technology"". Their website has no specifics. ",Jax3R,InvestmentClub,02-02-2012 08:18,3,3,0,t3_p6u55,t3_p6u55,,,0,0
c3n5lhr,"I feel like if we are going to do this as a group, we should follow a semi-realistic model. If someone has an investment idea they need to do 2 things:
Post a link to an analyst report about the company


Provide a summary of the report highlighting the main points (At least include NAV and FV/EBITDA)


They post this with the title ANALYST REPORT: Company ABC

In the comments, they type out the highlights. Discussion will ensue on the thread. After a few days, a final decision will be made (Still thinking about that process).

*edit:* Perhaps we use a system where if you like a stock, you upvote it, if you don't you downvote it. At the end of 5 days, if the stock has a majority of upvotes, we invest?
",[deleted],InvestmentClub,02-02-2012 13:14,4,4,0,t3_p6wz2,t3_p6wz2,,,0,0
c3n5lxm,Provide us links to information then we can discuss,[deleted],InvestmentClub,02-02-2012 13:16,3,3,0,t3_p7j3q,t3_p7j3q,,,0,0
c3n5m9f,"Chesapeake doesn't use oil sands and everybody is hydrofracking. And this winter has been unseasonably warm, so the price per million cubic feet is at like $2.00. Most analyst reports use a price of $4.50 so their caluculations are way off. 

Trust me, shy away from natural gas",[deleted],InvestmentClub,02-02-2012 13:18,2,2,0,t3_p6jm5,t1_c3myj28,,,0,0
c3n5rws,That sounds like a pretty solid bet. Or we could bet all of our money on a questionable pink sheet stock. ,Delepie,InvestmentClub,02-02-2012 13:44,2,2,0,t3_p6wz2,t1_c3n5lhr,,,0,0
c3n610f,I heard this company Enron is really killin it these days. Anyone have an analyst report on it?,[deleted],InvestmentClub,02-02-2012 14:20,3,3,0,t3_p6wz2,t1_c3n5rws,,,0,0
c3n639d,[deleted],[deleted],InvestmentClub,02-02-2012 14:29,1,1,0,t3_p6wz2,t1_c3n0ryd,,,0,0
c3n68au,"CHK, COP, among others have just cut gas production ~8%, however due to CHK's diversified portfolio, they still want to maintain high levels of liquid production, eg oil, which is paying now whereas gas is not, ~$2.30 or so. 

Either way, I am long on CHK and other domestic producers who are moving more of their production back to the states, see also Apache and the recent Cordillera purchase.",halfnerf,InvestmentClub,02-02-2012 14:45,1,1,0,t3_p6jm5,t3_p6jm5,,,0,0
c3n6at8,"Hindsight is definitely 20-20, I ultimately decided against buying some Apple, Feb 420 calls the day before their last earnings...oops. 

Anyways, I'm a little short-sighted in my trades since I basically trade options for spending money (I'm a full time student). It's worked well so far though. CAT's last earnings beat estimates by 34% and some say they'll do 41% over 2010 for the year. 

As far as Apple goes....Yeah, they're at a high, but every time they make it into the news everybody gets excited and the stock shoots up. I'm just looking into the near future with an iPad 3 announcement in March and maybe some absurdly high sales figures from it to accompany the next earnings in April. ",sapperx8,InvestmentClub,02-02-2012 14:53,1,1,0,t3_p6mp2,t1_c3n00mk,,,0,0
c3n6drf,This man speaks the truth.  Wouldn't it make more sense to go after a pipeline company anyway?  There may be a lot more natural gas (dropping prices) to move around the country on limited infrastructure.  Wouldn't the companies that move the stuff around profit?,Archaia,InvestmentClub,02-02-2012 15:02,1,1,0,t3_p6jm5,t1_c3n5m9f,,,0,0
c3n6e7i,I've done a lot of research on P&amp;Ds.  What is different about this pinky is they actually have a real product that customers have actually received.  Within their first month they sold out on amazon.  Normal P&amp;Ds have great claims and a product that isn't tangible...Also tiger woods would not sign and take payment in form of stock if he didn't see great potential in the company.  Do you think his team didn't preform DD on the company?  I know that celebrities and athletes have gotten fooled by P&amp;Ds in the past but the sheer volume of athletes they have signed makes me feel better about the company.   ,cantquitereddit,InvestmentClub,02-02-2012 15:04,-1,-1,0,t3_p6u55,t1_c3n2m14,,,0,0
c3n7fiv,"I think we may have our first buy. I like what this company's numbers are showing. Its EV/EBITDA multiple is pretty average to its peer group.

My opinion: 

Wait until the price sinks closer to $70, bid 1250@$70.50 or 1100 @$70.75",[deleted],InvestmentClub,02-02-2012 16:45,2,2,0,t3_p6ll4,t3_p6ll4,,,0,0
c3n7lyo,http://finance.yahoo.com/q?s=ATML,UpBLuigi,InvestmentClub,02-02-2012 17:01,1,1,0,t3_p7rg9,t3_p7rg9,,,0,0
c3n82p1,"Participation is very simple. Read the discussions about each stock and then vote on the ones you like. In 2-3 weeks I will purchase the highest voted stock, probably for $100,000.

10 positions sounds like a good number to me.",Zurevu,InvestmentClub,02-02-2012 17:42,4,4,0,t3_p6wz2,t3_p6wz2,,,0,0
c3n8bu6,"Ah good, glad you showed up. Maybe you can make a FAQ/Rules about how this is all going to go down. How often we'll buy, sell, number of positions etc.. I see there is already some good stuff in the side bar. Thanks for this great idea!",Shiftgood,InvestmentClub,02-02-2012 18:04,3,3,0,t3_p6wz2,t1_c3n82p1,,,0,0
c3n8cmy,"Awesome idea. I don't know much about stocks in general but I'm banking that you guys/gals do.

Baby needs a new pair of shoes../roll",Big_Bang_Machine,InvestmentClub,02-02-2012 18:06,1,1,0,t3_p6dut,t3_p6dut,,,0,0
c3n8fov,"I think the company may flux toward the downside given coal shipment reports but not may not make 70.  It looks as if stuck in a trading range.
",DarkHydra,InvestmentClub,02-02-2012 18:14,1,1,0,t3_p6ll4,t1_c3n7fiv,,,0,0
c3n8fw2,It's not all set yet. But I think we'll have 10 positions with one being reserved for shorting and 2 reserved for short term (&lt;1 year) holdings. That should allow for some pretty frequent trading to keep the subreddit active year round. Hope that answers your questions.,Zurevu,InvestmentClub,02-02-2012 18:14,2,2,0,t3_p6wz2,t1_c3n8bu6,,,0,0
c3n9kq2,https://www.google.com/finance?client=ob&amp;q=NYSEAMEX:LNG,IronRail,InvestmentClub,02-02-2012 19:52,1,1,0,t3_p7j3q,t1_c3n5lxm,,,0,0
c3n9lnc,"Actually celebrity endorsements are one of the biggest signs of a pump and dump. There used to be a Justin Beiber one. They have negative income since there IPO and they have been accumulating debt that they can't afford. Take a look at there financials, it wont be long until they go bankrupt. They have about 10x there revenue in ""selling general and administrative expense"" which is usually advertising expense and salary expenses. These guy's just want to get rich.

I agree with adding some risk, but risk with equal amount of potential reward. But this is just another pink sheet that will be out of business soon.",ttg314,InvestmentClub,02-02-2012 19:54,5,5,0,t3_p6u55,t1_c3n6e7i,,,0,0
c3n9pq3,"SOPA and PIPA are most likely over with. (Although when no one knew what was going to happen, it did affect them). Also those companies actually *help* InterActive corp, they have big contracts with google, and they just signed another 5 year contract. Google, Facebook, all get the majority of there money from advertising, unlike IACI. It does have competition, like any other company does but there is a low risk of this company being affected by it because of there constant acquisitions. ",ttg314,InvestmentClub,02-02-2012 20:03,1,1,0,t3_p6r70,t1_c3n48kt,,,0,0
c3n9si8,"The most recent news in the financial services industry and banking has been good, especially the regional banks. SNV bested analyst expectations and may climb simply as a result of the overall market performing well. I believe there is risk in the financial sector simply due to Europe but that has been steadily improving. Finally, SNV pays a dividend which is good for an investor like me. 

edit: ticker symbol",thedangerboy,InvestmentClub,02-02-2012 20:10,3,3,0,t3_p6mhb,t3_p6mhb,,,0,0
c3na363,"To hit $20 by the end of the year.

https://www.scotiaview.com/cs/Satellite/MungoBlobs/urldata/1294830617757/pdf/mfn____________minefind_26jan2012_122935_id60290010.pdf",TerryCopper,InvestmentClub,02-02-2012 20:36,1,1,0,t3_p86iw,t3_p86iw,,,0,0
c3naza0,Why are they so expensive? What are they expecting in terms of growth?,ttg314,InvestmentClub,02-02-2012 21:49,2,2,0,t3_p86iw,t3_p86iw,,,0,0
c3nb4yr,"In my opinion the question would be what position the price is at right now. I couldn't find a P/E on the gf page, so someone would need to do some digging for some statements. 

Natural gas seems like a good bet right now, but we would be better off investing in a company that's either emerging in this sector or is currently undervalued. Which could be this company, but we need more data. ",Delepie,InvestmentClub,02-02-2012 22:04,1,1,0,t3_p7j3q,t3_p7j3q,,,0,0
c3nb76k,Emails?,ttg314,InvestmentClub,02-02-2012 22:09,1,1,0,t3_p6r70,t1_c3n3thg,,,0,0
c3nb78o,Emails?,ttg314,InvestmentClub,02-02-2012 22:09,1,1,0,t3_p6r70,t1_c3n47jw,,,0,0
c3nec29,Why do you see it going over a dollar in the next few months?,ttg314,InvestmentClub,03-02-2012 03:16,1,1,0,t3_p8mf3,t3_p8mf3,,,0,0
c3necue,It's been above $650 before. *Maybe* it will be $650 in 20 years after 10-to-1 stock split.,ttg314,InvestmentClub,03-02-2012 03:18,2,2,0,t3_p8oj2,t3_p8oj2,,,0,0
c3new1g,"Do you guys have any other information on this company or why it should be included?  Price really doesn't tell me that much.  

I'm sorry I don't want to sound lazy, I could look everything up, but I really want to hear your opinion and why you feel strongly for the stock to be considered a candidate.  It doesn't have to be a long thing, just tell us what you see.  Maybe we can all learn from you wisdom =D",DarkHydra,InvestmentClub,03-02-2012 04:15,1,1,0,t3_p86iw,t3_p86iw,,,0,0
c3nf7bq,"They are cutting costs like crazy, I'm not sure people are really going to fly A&amp;A at all.  Awful company, awful service, just pathetic.  Management clearly doesn't give a shit about its shit company and doesn't make me want to invest at all... 

That's not to say we shouldn't speculate ;-p",DarkHydra,InvestmentClub,03-02-2012 04:48,1,1,0,t3_p8mf3,t3_p8mf3,,,0,0
c3nik3e,[deleted],[deleted],InvestmentClub,03-02-2012 14:56,1,1,0,t3_p86iw,t1_c3new1g,,,0,0
c3njiwo,Refer to the rules -------&gt;  That's what Im talking about.,DarkHydra,InvestmentClub,03-02-2012 16:32,1,1,0,t3_p86iw,t1_c3nik3e,,,0,0
c3nk2ck,Please read the sidebar. Your post belongs in /r/invest and not in /r/investmentclub. Thanks.,Zurevu,InvestmentClub,03-02-2012 17:20,2,2,0,t3_p9f6a,t3_p9f6a,,,0,0
c3nkcfo,"Look at the size of the company. .60 is low. They're coming from nothing right now, so, unless they fail completely, they will go up.",52hoova,InvestmentClub,03-02-2012 17:46,1,1,0,t3_p8mf3,t1_c3nec29,,,0,0
c3nkvx4,"Sorry, I will take it there.  Kinda sucks you don't see sidebars on the Alien Blue app.  My apologies, and happy investing!",AholeKevin,InvestmentClub,03-02-2012 18:32,1,1,0,t3_p9f6a,t1_c3nk2ck,,,0,0
c3nl4st,"The Investopedia Stock Simulator pays interest and dividends, just FYI.",bobbyt2012,InvestmentClub,03-02-2012 18:53,1,1,0,t3_p6dut,t3_p6dut,,,0,0
c3nlldb,Let's see some numbers,ttg314,InvestmentClub,03-02-2012 19:33,0,0,0,t3_p8mf3,t1_c3nkcfo,,,0,0
c3nmtlu,[deleted],[deleted],InvestmentClub,03-02-2012 21:18,1,1,0,t3_p86iw,t1_c3njiwo,,,0,0
c3nn93q,You're right. Thanks.,Zurevu,InvestmentClub,03-02-2012 21:55,1,1,0,t3_p6dut,t1_c3nl4st,,,0,0
c3nnda8,[deleted],[deleted],InvestmentClub,03-02-2012 22:06,1,1,0,t3_p6uck,t3_p6uck,,,0,0
c3nok2m,but they are govt-backed MBS,theduude,InvestmentClub,04-02-2012 00:05,1,1,0,t3_p6qgm,t1_c3mz77p,,,0,0
c3ns8lb,Thank you for providing this. Great review. ,forthall,InvestmentClub,04-02-2012 07:42,3,3,0,t3_p8p4k,t3_p8p4k,,,0,0
c3ns8lp,[deleted],[deleted],InvestmentClub,04-02-2012 07:43,0,0,0,t3_p8p4k,t3_p8p4k,,,0,0
c3nujtt,If need be I will shorten the time to stop voting/begin purchasing. Thanks for your concern. ,Zurevu,InvestmentClub,04-02-2012 16:35,1,1,0,t3_p9khk,t3_p9khk,,,0,0
c3nwqwv,"i don't know anything about penny stocks, but they always seem really sketchy to me, and are almost always short sold.",[deleted],InvestmentClub,04-02-2012 20:49,1,1,0,t3_payri,t3_payri,,,0,0
c3nx0w7,Why are you asking if we would short DEJ when all three links you've given suggests that DEJ will go up? Just curious.,Zurevu,InvestmentClub,04-02-2012 21:20,1,1,0,t3_payri,t3_payri,,,0,0
c3nxeq3,Resistance at .50 to maybe see a drop back down to near .40 cents. Or just wondering if this could be the break out uptrend. Either way I think it's a fun stock to play with in this club portfolio. ,Shiftgood,InvestmentClub,04-02-2012 22:02,1,1,0,t3_payri,t1_c3nx0w7,,,0,0
c3nxv42,"How do they make money with OkCupid? Advertising?

Who are IAC's competition?",Zurevu,InvestmentClub,04-02-2012 22:54,1,1,0,t3_p6r70,t3_p6r70,,,0,0
c3nxwpp,"&gt;we are a leading provider of subscription-based and advertiser-supported online personals services 

As for competitors, there is AOL and Yahoo, probably some more indirect competitors too.",ttg314,InvestmentClub,04-02-2012 22:59,1,1,0,t3_p6r70,t1_c3nxv42,,,0,0
c3nxxq2,"Neither, too risky.

Unless someone is a TA expert or something, I think we should avoid this.",ttg314,InvestmentClub,04-02-2012 23:02,4,4,0,t3_payri,t3_payri,,,0,0
c3ny649,How much money are they making off of OkCupid?,Zurevu,InvestmentClub,04-02-2012 23:28,1,1,0,t3_p6r70,t3_p6r70,,,0,0
